157	oportet esse in talibus virtutes morales.	uoler.uolũtat en quant xolo no uol. |E aq̃stas trs aĩas segõs lo ꝑhõpb en lo .ii.ḋ aĩa sõaxi ꝑtidas q̃ la uegetatiua es enlos orbr̃s sola ses las altrs E en los animals irracionals es la sensitiua 	390|391
		ab la uegetati¬ua señs la intellectiuadient 	392
		que axicom lo triangle es enlo quadrangle: 	393
		axi la uegetatiua es dins la sensitiua. Car totas las potencias 	394
		que hban las platas ban los bestias. 	395
		En lome son totas tres xegetatiuasensitiua e intellectiua. 	396
		que axi' com la xegetatiua es dins la sensitiua: 	397
		axi la xegetatiua esensitiua son en la intellectiua. 	398
		E perço es lome mes noble animal 	399
		que tots los altres.	400
