0|1	Postquam auxiliante Deo compleuimus |primam partem huius primi libri, 	Epus q̃ deus auidãt hauẽ cõplida la pͥmã ꝑtida da q̃st pͥmer libre 	0
2	in quo agitur de regimine sui, 	en lo qͥl es tractar del uirtuts. 	1
3|4	ostendentes in quo Reges et Principes |suam felicitatem debeant ponere, 	regimẽt desimatex demostrãt en qͣ̈l cosa los Reys els pͥnceps degen posar la sua benauẽturança. 	2
5|6	quia non decet |eos suum finem ponere in diuitiis, 	Quar nos ꝑtãy dells posar la sua 	3
7|8	nec in ciuili potentia, |nec in aliquibus talibus, 	si en riq̃hes ne enpotencia ciuil/ 	4
9	sed omnibus his 		
10	(ut supra plenius probabatur) 		
11|12	debent |uti tanquam organis ad felicitatem. 	ne en alc̾s coses aytals ans de cots coses aytals segons q̃ damũt era ꝓuat deuẽ usar axi cõ dorgues o de instrumens abenauẽturanca/ 	5
13|14	Suam autem felicitatem ponere debent |in actu prudentiae, 	Mas la sua benauẽturãça deuẽ posar en fer o en obra deprudẽcia 	6
15	prout talis actus est imperatus a charitate: 	o desauieasegons q̃ tal fer oral obra es manada ꝑ caritat/ 	7
16	nam tunc Reges habent felicitatem suo statui debitam, 	Quar lauos los Reys han benauẽturãca deguda 	8
17	et condignam, 	e cõdigͤal lur estament 	9
18	quando instigante Dei dilectione 	quan ells ꝑ instigacio dela amor de deusegõs sauiea 	10
19	secundum prudentiam regitiuam, 	o segõs pruden̾cia regitiua esegons ley 	11
20|21	gentem sibi commissam secundum legem, |et rationem sancte, et iuste regant. 	e segons raho regexẽ lagent quils ͤ comanada santamẽt eiustament. 	12
22	Principaliter ergo Regum felicitas ponenda est in ipso Deo, 	Donq̃s pͥncipalment la benauenturança dels Reys deu esser posada en deu axi q̃ 	13
23	et ex cognitione et dilectione eius studium suum, 	per couexença e ꝑ dilectio dell lur estudi 	14
24|25	et vitam suam ad hoc ordinare debet, |ut cognoscentes, et diligentes Deum, 	e lur uida studien ordonar a aço q̃ ells conexent 	15
26|27	tanquam veri ministri eius |secundum ordinem rationis dirigant Populum sibi commissum. 	e amant deu axi cõ au̾rades ministres o au̾tades ẜutdos seus segõs orde de raho endreçen o regesq̃n lo poble qͥls comanar/ aq̃stes coses donq̃s axi cõplides/. 	16
28	His ergo itaque peractis, 		
29|30	et ostenso in quo Reges ponere debeant |suum finem 	E de mostrar en qual cosa los Reys deuen posar la sua 	17
31	secundum ordinem superius praetaxatum, 		
32|33	restat ostendere |quibus virtutibus Reges pollere debeant. 	si segõs lorde damũt posat en lo.c.iii. Roman a demostrar de quals uirtuts los Reys degen resplendir 	18
34	Virtutes autem quaedam sunt quidam ornatus, 	quar les uirtuts son algũ ornament 	19
35	et quaedam perfectiones animae. 		
36	Oportet ergo prius ostendere, 		
37|38	quot sunt potentiae animae, |et in quibus potentiis habent esse virtutes. 	e algunes ꝑfeccions dela aĩa ¶Pͥmerament donques coue a demostrar quãtes son les potẽcies dela aĩa e en qͣls potẽcies han ꝑsser les uirtuts/ 	20
39|40	Consequenter autem manifestabitur, |quomodo virtutes sunt distinguendae. 	Empero ap̾s sera maĩfestat en qͣl manera les uirtuts deuẽ eẽr deꝑtides/ ¶Enapͥs nos demostrarẽ quãtes son per nõbre aq̃stes uirtuts¶S quals da quells son pͥncipals 	21
41	Postea vero ostendemus, 		
42	quot sunt numero huiusmodi virtutes, 		
43|44	et quae illarum sunt principales, |et secundariae. 	e qualsson secundaries o meỹs pͥncipals 	22
45	Deinde autem declarabitur singulariter, 	E finalmẽt sera declarat en especial q̃l 	23
46	quae sit unaquaeque illarum virtutum, 	sia q̃scuna daq̃lls uirtuts 	24
47|48	et quomodo decet Reges, |et Principes tales virtutes habere. 	E enqͣl mana̾ se ꝑtaỹ dels Reys e dels pͥnceps hau̾ tals 	25
49	Potentiae autem animae sic distingui possunt, 	uirturs¶Les potencies dela aĩa poden esser deꝑtides en aq̃sta 	26
50|51	quia potentiae animae quaedam sunt naturales, |quaedam cognitiuae sensitiuae, 	man̾a¶Quar algunes sõ nãls ¶Algunes cog̾tiues o conexedores sensitiues 	27
52	quaedam appetitiuae, 	¶Alguñsappetitiues o uolũtaries/ 	28
53|54	et quaedam intellectiuae. |Naturales potentiae sunt illae, 	E alt̾s entellectuals ¶les potẽcies n̾als son aq̃lls en les qͣls nos ꝑtiçipã 	29
55	in quibus communicamus cum vegetabilibus, et plantis, 	ab les coses qui han uida |e ab les plantes 	30|31
56	ut potentia nutritiua, augmentatiua, generatiua, 	axicõ es potẽcia nucͥtiua/ crescitiua 	32
57	et talia quae etiam ipsis arboribus competunt. 	e gen̾atiua eles alt̾s aurals qͥaximatex couenen als arbres 	33
58	Potentiae vero cognitiuae sensitiuae, 	¶Mas les potencies conexedor̃s sensitiues son la uista 	34
59	sunt visus, gustus, auditus, et talia, 	lo gustar ol tascar lo tochar |e les altres ayrals 	35|36
60|61	in quibus communicamus cum brutis. |Appetitiuae vero distinguuntur: 	en los quals nos comunament ꝑticipã ab les besties brutals ¶Mas les potencies appetiues o uolenteroses son deꝑtides/. 	37
62	nam quidam appetitus est in homine, 	Quar algũ appetimẽt o alguna uoluntat es en hõ 	38
63|64	in quo non communicat cum brutis, ut est appetitus sequens intellectum: |quidam vero in quo communicat cum eis, 	en lo qͣl ell no ꝑticipa 	39
65|66	ut appetitus sequens sensum. |Appetitus autem sequens sensum potest 	ab les besties 	40
67|68	nominari sensualitas: |sequens intellectum nominatur voluntas: 	brutals/ 	41
69|70	secundum quem modum loquendi bruta habent sensualitatem, |et appetitum sensitiuum, 	axi cõ es lappetumnent o la uoluntat q̃ seguer lenteniment 	42
71|72	sed non habent voluntatem, et intellectum. |Virtutes ergo, 	Mas algũ alcre es en lo qual ell ꝑticipa ab ells axi cõ 	43
73	de quibus loqui intendimus, 	es lappetiment o lauolũtat 	44
74	quae sunt quidam habitus laudabiles, 	qui segueyx lo senycorꝑal pot eẽr appellat sensualitat/ 	45
75	vel erit in potentiis naturalibus, 	En aq̃ll qui seguex lentenimẽt sia appellat uolũtat¶Segõs la qͣlmanera de parlar les besties brutals han sensualitat e appetimẽt sensitiu/ 	46
76	vel in ipsis sensibus, 	Mas no han uoluntat 	47
77|78	vel in appetitu sensitiuo, |vel in appetitu intellectiuo, 	co es assaber appetiment intellectiu ¶Donq̃s les uirtuts dels quals nos entenẽ aꝑlar 	48
79|80	vel in ipso intellectu, |vel in omnibus his, 	qui sõ alguns habits o concebimẽs dignes de lahor 	49
81|82	vel in aliquibus horum. |In potentiis autem naturalibus esse non possunt, 	o seran en les potẽcies n̾als/ o en les potençies sensitiues/ o enlappetiment sensitiu o en lappetiment incellectiu o en lentemment o entot̃s aq̃stes potẽcies o en algunes daq̃stes. En les potencies n̾als no poden eẽr 	50
83|84	quod tripliciter patet. |Primo, quia ex naturalibus nec laudamur, 	la qual cosa entres ma̾es es manifesta ¶pͥmerament per tal cõ 	51
85	nec vituperamur 	per les potẽcies 	52
86	nullus enim dicitur <pb n="45"/> 	nãls no son lohars ne uituꝑars qͣr negũ 	53
87	bonus homo 	hom no es dit bo 	54
88|89	ex eo quod habeat digestiuam bonam, |vel bonam augmentatiuam. 	per co cõ el ha bona digestio o bona crexẽça ¶En ap̾s entals potẽcies no han esser aq̃stes uirtuts ꝑ 	55
90|91	Secundo, in talibus non habent esse virtutes: |quia virtus est aliquid 	tal cõuirtut es alguna cosa segõs raho segõs q̃ 	56
92|93	secundum rationem, |ut probari habet 2 Ethic’. 	pot esser ꝓuat en lo.ii. libre de les echiq̃s/ 	57
94|95	Potentiae autem naturales |(secundum quod huiusmodi) 	E les potẽcies nalssegõs q̃ son naturals no obehexen ala rao 	58
96	rationi non obediunt: 		
97|98	nam siue quis ratiocinetur, |siue velit, 	Quar sia q̃ algũ us deralo o deuolũtar ꝑlant 	59
99	non propter hoc 		
100|101	(per se loquendo) |potentiae naturales variantur 	per si les potẽcies nacurals ꝑ aco no uariegen en les sues obres/ ans costep̃s segõs la mana aells possible o segõs 	60
102|103	in actibus suis, |sed semper secundum modum sibi possibilem suas actiones efficiunt. 	que elles poden fan les sues obres. 	61
104|105	Tertio, in talibus potentiis non sunt habitus, et virtutes, |qui habitus sunt 	Encara entals potẽcies naturals no son los habits ols cõcebimẽs iurtuosos ne les uirtuts/. 	62
106|107	ad determinandum potentias, |ut bene vel male agant, 	QQuar los habirs ols concebimnens son ꝑ det̾menar les potẽçies q̃ façẽ be omal 	63
108|109	ut per habitus vitiosos determinatur potentia |ad agendum male, per virtuosos ad agendum bene: 	¶On ꝑlos habirs o per los concebimẽs uiciosos es det̾menada la potẽcia/ afer mal/ E per los habics o per los cõcebimẽs uirtuosos afer be donq̃s cõ nacura sia det̾menada a una cosa eles potẽcies nals sufficiẽtment sien det̾menades 	64
110	cum ergo natura sit determinata ad unum, 		
111	et potentiae naturales sufficienter determinentur ad agendum, 		
112|113	ex natura sua secundum eas nec sumus vitiosi, |nec virtuosi, 	per lur natura a obrar segons elłs nos no som uiciosos ne uirtuosos/ parlant en aq̃lla manȧ 	65
114|115	ut hic de vitio, |et virtute loquimur: 	que nos ꝑlam açi de uici e deuirtut ꝑral 	66
116|117	quare in eis huiusmodi virtutes esse non possunt. |His ergo tribus rationibus, 	donq̃s en elles no poden eẽr rals uirtuts ¶per aq̃stes .iii. rahonsdonq̃s ꝑ les quals es ꝓuat q̃ les uirtuts no poden esser en les potẽçies nals 	67
118	per quas probatum est virtutes 		
119	non esse in potentiis naturalibus, 		
120|121	probari potest eas non esse in cognitione sensitiua, |siue in potentiis sensitiuis. 	pot esser puat q̃ elles no poden esser enla conexẽça sensitiua o en les potẽçies sensitiues/. 	68
122	Nam sicut non laudamur, 	Quar axi cõ nos no sõ leats 	69
123	nec vituperamur ex potentiis naturalibus: 	ne uituperatsper les pocẽcies nals 	70
124|125	sic non laudamur, |nec vituperamur ex sensibus. 	e axi matex nos no som lohats ne uituꝑats 	71
126|127	Nam sicut nullus laudatur |tanquam bonus homo, 	per los seỹals corpals/ Quar axi cõ negũ no es lohat otengũr ꝑ bon hõ ꝑ 	72
128	ex eo quod bene digerit, 	co cõ ell fa be digestio 	73
129|130	vel bene crescit: |sic non laudatur 	o crex be/. Aximatex no es lohar ꝑ 	74
131	ex eo quod acute videt, 		
132|133	vel subtiliter audit, |nisi forte hoc esset per accidens, 	co cõ ell ueuagudament o hou subailmẽt si donq̃s ꝑ auẽtura aco no era ꝑ accident o accidentalmẽt axi cõ 	75
134	ut si quis ex superflua comestione, 		
135|136	vel ex nimia potatione |incurrisset ophthalmiam oculorum, 	si algu per massa mãgyar o per massa beure acõsegia malaltia de obralumia en los ulls per q̃ no uehes be o acõseguia debilirat en lescomach ꝑ 	76
137	ne bene videret, 	q̃ no fahes be digescio 	77
138|139	vel debilitatem stomachi, |ne bene digereret: 	aytal seria repͥs no ꝑral cõ ell fa mal digestio o ꝑ tal cõ ell noueu benclar 	78
140	increparetur ille, 		
141	non quia male digerit, 		
142	vel quia non clare videt, 		
143	quia clare videre, 	quar clar ueure 	79
144|145	et bene digerere |(per se loquendo) 	e fer be digestio ꝑsi 	80
146|147	non est in potestate hominis: |sed increparetur ex nimio potu, 	ꝑlant no es en so poder del honMas ell seria rep̾s de massabeure 	81
148|149	vel ex superfluo cibo, |nam erat in potestate sua, 	o demassa mangyar ꝑ ço cõ seria en lo seu poder q̃ 	82
150|151	ut posset uti potu, |et cibo moderate. 	pogues usar tempradamẽt demãgyar o de beure ⁊ 	83
152	Secundo in sensibus non est ponenda virtus moralis, 	Encara en los seỹs no deu eẽr posada uirtut moral/. 	84
153|154	quia sicut potentiae naturales non obediunt rationi, |quia secundum regulam rationis nullus magis, 	Quar axi cõ les potẽcies nals no obehexẽ ala raho persocõ segõs laregla dela raho 	85
155|156	vel minus augetur, |vel magis, et minus digerit: 	negũ no es crescut ne ne mes ne meỹs ne fa digescio mes ne meys ¶Axumnateix les seỹs no obeheren ala raho/. 	86
157	sic nec sensus obediunt rationi, 	Quar no es en lopoder del hom ueure 	87
158	non enim est in potestate hominis videre clarius, vel minus clare: 	pus clarament o meỹs claramentꝑ la q̈l cosa 	88
159	quare si virtus moralis est aliquid secundum rationem, 	si uirtur moral es alguna cosa segõs 	89
160	huiusmodi virtus in sensibus poni non debet. 	rah̾o/ tal uirtut no deu eẽr posada enlos senys/ 	90
161	Tertio in talibus non est moralis virtus, 	Encara les potẽcies sensitiues no deueẽr posada uirtut moral/. 	91
162|163	quia sicut potentiae naturales |sufficienter determinantur 	Quar axi cõ les potẽcies uals sufficientmẽt sõ detinenades 	92
164|165	ad actiones suas per suam naturam: |sic et sensus. 	ꝑ la sua natura ales sues obres/ aximateix los seỹs/ Car axi cõ lo foch rant escalfa quãt escalfarpot ꝑla 	93
166|167	Nam sicut ignis tantum calefacit, |quantum potest calefacere, 	q̈l 	94
168	propter quod, quia determinatus est in actione sua, 	cosa ell es det̾menat enla sua obra 	95
169|170	nec laudatur, |nec vituperatur, 	ne es lohat ne uituperat 	96
171|172	nec est in eo virtus moralis: |sic quia potentia digestiua tantum digerit quantum potest digerere, 	ne es en ell uirtut moral Arimatexꝑtal cõ lapocẽcia digestuia aytant fa digescio quãt digerir 	97
173|174	et oculus tantum videt |quantum potest videre, 	pot el ull tant ueu quãt pot ueure en elles no pot eẽr uirtut 	98
175	in eis virtus moralis esse non potest. 	moral/ 	99
176	Nam per virtutem moralem determinatur potentia ad agendum: 	Quar per la uirtut moral es dec̾iuenada la pocẽcia afer aobuir 	100
177	haec autem sufficienter determinantur 	mas aq̃stes |suffi/cientinẽt son dec̾menades ales obres ꝓpͥes 	101|102
178	ad actiones proprias per naturam: 	per lur natura/. 	103
179	non ergo indigent virtute morali. 	Donq̃s elles no hau ops uircut moral¶ 	104
180|181	Si ergo nec in potentiis naturalibus, |nec in sensibus est virtus moralis, 	Si donq̃s en les potẽcies nals ne enles sensitiues no es uirtut moral cõ 	105
182|183	cum praeter potentias naturales, |et sensus non sit nisi intellectus, 	sẽs les potẽcies nãls els seỹs corꝑals 	106
184|185	et appetitus intellectiuus, et sensitiuus, |oportet esse in talibus virtutes morales.	no sien sino lentenimẽt el appetiment o la uolũtat intellectual/ coue en tals potẽcies sien les uirtuts morals:	107
