748	si le fiert par entre l escu	aquel que yua de tras	679
749	et le bras	e firiolo	680
750|751	si qu il li trenche le poing|et li escus chiet a terre	asi duramente entre el onbro y el escudo	681
752	et cil torne en fuies		
753	qui maheignié se sent	que tenia enbraçado	682
		que el braço conel escudo le fiço bolar en tierra	683
754	Et Lancelos vient a l autre	e el cauallero fuese fuyendo	684
755	qui ja se relevoit sel fiert de l espee	ansi llagado|como estaua	685|686
756	si grant cop qu il li fet le hialme voler en la place	e lançarote fuese enpos el otro|que auia fincado	687|688
		e firiolo	689
		asi enlo alcançado ençima del yelmo	690
757	Et quant cil sent son chief nu	que selo fiço volar dela cabeza	691
758	si cria merci	e el cauallero desque vido su cabeça desarmada Con pauor de muerte|que ovo pidio le merçed	692|693
759	et dist qu il ne l ocie pas	e dixole ay buen cauallero no me matedes	694
760|761	kar il est pres de sa volenté fere|Or te covient donc fet Lancelos fiancer	que yo fare toda vuestra voluntad tu me juraras dixo lançarote	695
762	que tu le cors mon seignor Galehout conduiras a la Dolerose Garde	que llebes el cuerpo demi señor galeote ala dolorosa guarda	696
763	et iluec le feras garder	e desque y fueres	697
764	tant que je i viegne;		
765|766	et se l en te demande|qui t i envoie	si te preguntaren quien te ymbia tu les diras	698
767	si diras « cil		
768	qui ot les ames blanches le jor	que el cauallero delas armas blancas	699
769	que li chastials fu conquis	que el castillo conquisto te ymbia alla	700
770	Et il li fiance	e el cauallero selo juro	701
771	que tot ensi le fera il	asi façer|e lançarote se fue	702|703
		luego parala tumba	704
772	si tire de grant force qu a pou qu il ne se deront tos	e tomo a manos el cobertor Porel Cabo|que mas hera grueso	705|706
773|774	si que li sans li vole par mi le nes|et par mi la boche	asi afuerça porlo leuantar quela sangre le quebro porla cabeça	707
775	et li cors li sue d anguoisse	e porlas narizes quelas açerdas de todo el cuerpo se le estendieron muy fuertemente|asi que	708|709
776	Mais por tote la destrece ne remaint qu il n ait la tombe levee en haut à; mes nule dolors qu il eust onques ne monte rien a cele dolor qu il ot	por fuerça ovo el cobertor a leuantar maguer Mucho hera pesado Mas nunca el tal duelo ovo|como estonçe	710|711
		e tal Pesar	712
777	quant il vit le cors Galehout tot ensi armé com il estoit;	quando el vido el cuerpo de Galeote|e estaua armado de todas armas	713|714
778	si trova s espee delés lui	e tenia su espada cabe	715
779|780	qui molt estoit|et bone	si que hera muy buena	716
781	et clere;	e clara	717
782	et sans faille de l espee meesmes se fust il ocis se la damoisele ne li eust tolue erraument	e sin falta el se ouiera conella muerto|si la donçella	718|719
		Que del lago auia venido delas manos no sela tirara	720
783	et la fist covrir des plus riches pailes de laiens	e luego fiço façer lançarote vnas andas|e cobrir de muy Ricos paños	721|722
784	et quant il l ot atornee al plus richement qu il pot li chevaliers prisons li dist Sire fet il se l en movoit tot de nuis ce seroit sens	e poner enellas el cuerpo de Galeote|e el cauallero Dixo a lançarote señor yo vosloaria	723|724
785	—	si vos plugiese|que luego Mouiese de aqui conel cuerpo de galeote	725|726
786|787	Por quoi|? fet il	Porque dixo lançarote	727
788	—	porque señor dixo el cauallero	728
789	Por ce que se li chevalier de cest païs savoient	porque si los caualleros desta tierra lo supieren	729
790	que l en len deust porter il feroient gaitier les trespas	que de aqui lo queredes llebar faran guardar los tres pasos	730
791	si qu il seroit arestés en alcun lieu ;	asi que sera detenido en algund lugar	731
792	et por ce vos loeroie je qu il meust orendroit	e poresto seria bien	732
793|794	kar il seroit bien eslongiés ains qu il fust jors XX|lieues englesches	que nos alongasemos de aqui esta noche vnas diez leguas bien acordades Dixo lançarote	733
795	Et il s i acorde bien;		
796|797	si met la litiere sor Il|palefrois amblans	e luego fiço poner las andas sobre dos palafrenes muy andadores	734
798|799	et enportent ensi Galehout fors de sa region;|si en font li frere grant duel	e lleuarlo	735
800|801	et molt en sont corocié|et dolenta de ce	asi Mas mucho ouieron gran pesar los frailes	736
802	que l en l enporte	quando asi lo vieron lleuar	737
803	Et Lancelos le convoie grant piece de nuis plorant	e lançarote fue gran pieça llorando conel cuerpo de Galeote	738
804	et regretant sa proesce	e diçiendo sus proezas	739
805	et sa valor	e su valor	740
806	et se ne fust la damoisele	e si no fuese porla donçella	741
807	qui avec lui estoit molt en eust plus fet qu il ne fist	que del lago auia venido Mucho fiziera mayor duelo	742
808	mais ele l en detorna	mas ella selo estoruaua	743
809	et il deffendi al chevalier	e anteque lançarote del cuerpo se tornase Dixo al cauallero yo vos defiendo	744
810	que il nel feist en terre metre devant	Que el Cuerpo demi señor galeote no fagades enterrar fastaque yo mesmo alla vaya|e el Cauallero dixo	745|746
811	que il fust venus	que asi lo faria	747
812	Si se part atant li uns de l autre	entonçe se partio dellos lançarote	748
813	et il retorne a l abeie	e tornose al abadia	749
814	si se couche c onques la nuit ne volt mengier ne boivre	mas en toda aquella noche no quiso comer ni veuer	750
815	por chose	por cosa	751
816	que l en li deist ains plora	que le dixesen|e non fazia sino llorar	752|753
817	et dolosa tot adés;	e mucho se quexaua	754
818|819	si li anuioit molt li jors|qui tant demoroit a venir	Porque tanto aquella noche le duraba	755
820	a Al matin	e luego	756
821|822	si tost com li jors aparut se leva|et oi messe entre lui	Que el dia aparesçio lançarote se leuanto	757
823	et la damoisele	e la donzella otrosi	758
824	et puis s arma	e fueron a oyr misa	759
825	Lors li dist ele les noveles de Boort	e desque la misa fue aCabada Armose|e despidiose del fraile	760|761
		e entro ensu camino conla donzella	762
		e ellos	763
		asi yendo la donçella le conto nuebas de boores	764
826	et ce qu ele en avoit veu devant Honguefort	e de|como le contesçiera enel castillo de ongeforte	765|766
827	et il en fu molt liés	e el fue dello muy alegre	767
		e ella le dixo sabed señor	768
828	Et ele li dist Sire il vos vet querant ne jamés ne finera tant qu il vos avra trové	que vos a buscado|e nunca jamas quedara fastaque vos falle Ay donçella dixo lançarote	769|770
829|830	— Damoisele fet il se vos le cuidiés trover ains de moi je vos voldroie proier|que vos feissiés tant	si vos lo cuidades fallar yo vos querria rrogar	771
831|832	por moi|que vos li portissiés ceste espee	que fiziesedes tanto pormi quele llebasedes esta espada	772
833	qui fu mon seignor Galehout	que fue demi señor galeote	773
834	et li dites qu il la DOrt de par moi	e dezilde quela traiga pormi amor	774
835	que molt est bone	ca mucho es buena	775
836|837	Et ele dist qu ele le trovera par tens|et bien fera cest message;	e fermosa yo lo fare dixo la donçella de grado	776
838	si s en part atant de lui	Luego se partio el vno del otro	777
839	et il s en vet droit vers le chastel de Floego	e lançarote se fue contra el castillo de florenga	778
		e andubo tanto	779
840	si i vint a hore de prime	que llego alla ante de prima	780
841|842	Et il esgarde es pres defors la vile|si voit molt grant gent entor le feu ou l en devoit ardoir la suer Meleagan	e vio ante la villa gran jente alrrededor de vn fuego	781
843|844	et quant il aperçoit le feu|si a poor de la damoisele	e en aquel fuego auian de quemar ala hermanade meliangas	782
845	Lors broche le cheval	e lançarote	783
846	et vint errant cele part tant com il puet del cheval traire	que aquello vido dio delas espuelas al cauallo	784
847	Et quant il est venus jusque la	e llego alla	785
848	si esgarde	ca bien cuidaua	786
849	et voit la damoisele		
850	qui ja estoit amenee al feu	que ya quemauan la donçella	787
851	por destruire		
852|853	si estoit en pure sa chemise|et le tenoient	e quando el y llego vio la donçella estar ante el fuego envna muy pobre camisa	788
854|855	VI|pautonier trois d une part	e tenianla seis billanos tres dela vna parte	789
856	et trois d autre;	e tres dela otra	790
857	si n atendoient a geter le el feu fors le commandement as juges	e no esperauan al sino el mandamiento delos juezes parala hechar enel fuego	791
858	et ele ploroit trop durement	e la donzella lloraua muy fuertemente	792
859	et regretoit Lancelot Ha gentilx chevaliers Lancelos	e llamaua a lançarote	793
860	kar pleust ore a nostre Salveor	e deçia ay mi buen cauallero|e pluguiese agora anuestro señor	794|795
861	que vos seuissiés ceste novele	que supiesedes estas nuebas	796
862	si fuissiés pres de ci a demie lieue! Certes a l aide de Dieu	e estubiesedes çerca de aqui media legua|e conla ayuda de dios	797|798
863	et de la vostre seroie je encore anuit rescosse malgré tos mes enemis	e conla vuestra seria yo aCorrida|e librada	799|800
864	Mais vos ne le savés pas a	e mas vos no lo sabedes	801
865|866	si me covendra ore morir|por la vie	e asi me conuerna a morir	802
867	que je vos sauvai emprés Dieu;		
868	mais certes il ne m en poise pas tant	mas no me pesa tanto pormi	803
869	por moi com il fet	como porel pesar	804
870	por le coros		
871	que vos en avrois	que vos abredes	805
872|873	quant vos le savrois|Mais ce me reconforte molt	Quando lo supieredes Mas esto me conorta mucho	806
874|875	que je sai bien|que les damoiseles gaaigneront tant en ma mort	que yo se quelas donçellas ganaran mucho enla my muerte	807
876	que jamés nule ne vos requerra d aide	que jamas donzella no vos rrequirira de ayuda	808
877	que vos li faillois tant com il vos remenbre de moi	que le vos non fagades tanto|que vos acuerde demi	809|810
878	kar vostre cuers est	ca vos sodes tan noble	811
879	si frans qu il ne puet estre sans trop grant merites rendre a totes celes	e tan franco|que siempre dareis buen galardon a todos aquellos	812|813
880	qui de par moi se reclaiment:	que demi se lamentaren	814
881	si m est avis qu il m est molt miels a m ame de morir	e mucho me sera buena al alma esta muerte	815
882	por loialté fere	que Resçibire	816
883|884	et por geter de prison|si vaillant home comme vos	porque saque de prision atan noble ome Como vos	817
885	que vos fuissiés mors par la desloialté de Meleagan	que vos fuerades muerto porla deslealtad de meliangas	818
886	qui en prison vos avoit mis par traïson	que en prision vos tenia|por su gran traiçion	819|820
887	Ensi disoit la damoisele molt tendrement plorant	e esto deçia la donçella llorando muy dolorosamente	821
888	et lors vint Lancelos poignant cele part ou il la vit:	e lançarote vino|luego aquella parte	822|823
889	si dist a cels	do la donçella tenian	824
890	qui le tenoient Laissiés la damoisele! —	e dixo aquellos|que la tenian dexadla donçella	825|826
891|892	Por quoi sire fet J|chevaliers armés	Porque señor dixo vn cauallero	827
893	qui avant saut le lairons nos	que delante salio la dexaran ellos	828
894|895	? —|Por ce fet il	Porque dixo lançarote	829
896	que vos n avés droit en li	Porque no auedes derecho	830
897|898	por fere mal|—	Porque la matar	831
899|900	Si avons fet cil|si grant	si auemos dixo el muy grande	832
901|902	que nos l avons atainte de murdre|dont je l apelai	ca ella fue acusada de muerte	833
903	et ele s en offri a deffendre	e ella se ofreçio a defender porvn cauallero	834
904	mais ele ne trova onques	mas nunca fallo cauallero	835
905	qui por li en prist escu	que porella quisiese tomar escudo	836
906	et ce n est pas merveille	e no es marauilla	837
907	que chescuns set bien quele en a desloialment ovré	ca cadavno sabe su deslealtad|e que es Esta deslealtad dixo lançarote	838|839
908|909	— De quoi|? fet Lancelos	Que es dixo el Cauallero	840
910|911	— De ce fet il qu ele delivra Lancelot|por Meleagan ocirre son frere	que solto De Prision a lançarote Para matar a meliangas su hermano	841
912|913	—|Qui estes vos	si vos dixo lançarote osaredes mostrar	842
914|915	? fet cil|— Uns chevaliers sui fet Lancelos	que hizo deslealtad o traiçion enlo soltar yo so presto dela defender Quien sodes vos dixo el cauallero vn cauallero dixo Lançarote so	843
916|917	qui vieng ceste part|por ceste damoisele deffendre	que vengo aqui poresta donçella defender	844
918	— Par foi fet cil se je voloie il ne m en covendroit ja combatre	Por buena fee dixo el cauallero|si yo quisiere no me conbatiria	845|846
919	kar des ier en est ! ele atainte	mas sobre esta rrazon	847
		que ayer se cumplio el plazo enque ella se auia de defender	848
		mas yo se	849
920|921	puis qu ele ne pot trover|qui la deffendist	que no fallo quien la defendiese	850
922	mais je sent ma querele a	mas yo se|que ella es	851|852
923	si loial	asi enesto desleal	853
924|925	et si droituriere qu il n a chevalier el monde vers cui je ne l osaise bien prover au|? grant droit	que no a cauallero enel mundo conquien no me osare conbatir sobre esta Razon	854
926|927	que je i ai|— En non Dieu fet Lancelos or i parra	ansi me esfuerço enmi gran derecho enel nombre de dios dixo lançarote agora paresçera	855
928|929	que je sui pres|que je la desfende vers vos	que yo so presto dela defender de verdad dixo el cauallero porla mi caueza vos moriredes porende	856
930	— Voire fet cil par mon chief		
931	et vos en morrois comme traitres	como traidor	857
932	et desloials	e desleal	858
933	Lors traient la damoisele loins del feu	e luego tiraron la donçella del fuego	859
934|935	et li chevalier s entreslongent li uns de l autre|si s entrevienent	e los caualleros se dexaron correr el vno contrael otro	860
936	si tost com li cheval pueent aler	quanto los cauallos los pudieron lleuar	861
937|938	et s entrefierent des glaives|si durement qu il les font voler en pieces;	e firieronse delas lanças tan fieramente	862
939|940	puis s entrehurtent|si des cors	asi que las lanças fiçieron bolar en pieças	863
941	et des visages qu il n i a celui	e toparon envno delos cuerpos	864
942	qui tos ne soit estordis		
943	et desconreez	e delos yelmos	865
944|945	Mais li chevaliers par est|si estonés qu il ne se puet tenir en sele ains vole jus del cheval	que el caballero no se pudo tener enla silla ante cayo del caballo en tierra	866
946	et al parchaoir feri li quins del hialme en la terre	e al caer ouierasele el pesqueço de quebrar	867
947	si qu a bien pou qu il n a le col brisié	ca dio de cabeça del yelmo en tierra	868
948|949	Et quant Lancelos a fet son tour|si descent	e quando lançarote torno desçendio	869
950	kar honte li seroit de requerre a cheval celui	ca el lo no queria acometer de Cauallo	870
951	qui est a pié;	porque el estaua de pie	871
952|953	si trait l espee|et cort sus a celui	e metio mano al espada	872
		e fuese parael	873
954	qui ja se relevoit	que ya hera leuantado	874
955	si li done par mi le hialme tel cop qu il le fet a terre flatir des paumes	e diole tal golpe ençima del yelmo quele fiço dar de manos en tierra	875
956	et des genols ;	e el|que se yua	876|877
957|958	puis recuevre I|autre cop	por leuantar diole otro golpe dela espada	878
959	et le fiert	que dio	879
960	si qu il le fet tot parchaoir	luego conel atordido en tierra	880
961	et le prent par le hialme	e tomolo Porel yelmo	881
962	si le traine jusqu al feu	e tiro tan Reçiamente|que selo arranco dela cabeza	882|883
963|964	et le gete dedens|Et cil estoit	E el finco muy estordido	884
965	si estordis	e sin fuelgo	885
966	et tant avoit perdue la force del cors	e asi auia perdido la fuerça del cuerpo	886
967	que relever ne se pot	Que se no podia rreboluer	887
		e lançarote tomolo porlos braços	888
968	si le covint remanoir el feu	e dio conel enel fuego	889
969	et morir en tel maniere	e dexolo ay morir ental manera	890
970|971	Et lors vienent avant cil|qui le champ gardoient	e luego vinieron a lançarote los quela guardauan	891
972|973	si dient a Lancelot qu il en a assés fet|et li rendent la damoisele saine	e dixeronle señor asaz auedes fecho	892
974	et haitiee	e los	893
		que tenian la donçella traxeronsela delante	894
975	et il la fet vestir	e el fizo la vestir	895
976	puis li demande qu ele velt qu il face mes	e dixole donçella|que queredes	896|897
977	Sire fet ele	mas que faga señor dixo ella	898
978|979	que vos me menés a salveté a mon chastel|Et il dist	que vaiades con migo fasta mi castillo Donçella muy de Grado dixo lançarote	899
980|981	que volentiers:|si le fet monter	e luego se fueron parael castillo	900
982	et le conduit jusqu al chastel ou ele l ot gardé maint jor	e aquel castillo auia nombre galeforte	901
983	et seoit sor une petite riviere	e estaua ençima devna pequeña Ribera	902
984	si estoit molt aaisiés de totes choses	e estaua bien asentado de todas partes	903
985	et fors a merveille	e fuerte amarauilla	904
986	Et quant Lancelos vint la il ne fet pas a demander se l en li fist joie	e quando lançarote y llego no cale demandar|si conel fizieron gran alegria	905|906
987	kar cil del chastel savoient ja bien	ca los del castillo sabian muy bien	907
988|989	que lor dame estoit delivree par I|chevalier	como su señora hera ya librada Porvn cauallero	908
990	qui o li venoit	que auia venido	909
991|992	Et quant il le virent|si le reçurent a	e quando los del castillo los vieron venir a lançarote	910
993	si grant joie com se ce fust Damedieu meismes	ansi lo Reçiuieron con gran alegria|como si la madre de dios Mesma fuese	911|912
994	et s agenoillent tuit devant lui	e fincaban los ynojos|por do el venia	913|914
995	et crioient a une vois tuit ensamble Sire sor tos cels del monde soiés vos bien venus	e deçian todos avna voz bien venga el buen cauallero sobre todos los omes del mundo	915
996	qui nostre grant duel avés torné en grant joie A tel feste ont laiens Lancelot receu	Que nuestro duelo torno en alegria A tal Plazer y a tal alegria fue lançarote rrescebido enel castillo	916
		como vos digo	917
997	et quant il ont la damoisele descendue devant son mestre palés	e desque la donçella desçendio antesu gran palaçio	918
998	si s en volt aler maintenant	luego se quiso yr don lançarote	919
999	kar il n estoit mie encore plus de tierce	que aun no hera|mas de terçia	920|921
1000	Mais ele le prist al frain	mas ella lo tomo porel freno	922
1001	et le fist descendre a fine force a	e lo fiço decender a fina fuerça|e dixole	923|924
1002|1003	et dist Par Sainte Crois|vos ne m eschaperois mie ensi	Por sancta cruz don cauallero vos no me escaparedes	925
		ansi e	926
1004	Lors le commande a desarmer	luego lo mando desarmar	927
1005	et vaslet saillent avant	e los escuderos	928
1006	por fere son commandement a;	que y estauan fizieron|luego su mandado	929|930
1007|1008	et tantost com il ot son hialme osté|et ele le conut	e luego quele tiraron el yelmo la donzella corrio ael	931
1009|1010	si li cort les bras tendus|et le volt baisier en la boche	e echole los braços al cuello	932
1011	quant il li guenchist		
1012	et ele li baise la face		
1013	et le col	e enla faz	933
1014	et le menton		
1015|1016	puis que autre chose n em puet avoir b;|si plore de pitié	e començo a llorar con piedad	934
1017	et li dist Ha gentilx chevaliers tant vos avoie desirré a veoir ains	e dixo ay señor|quanto vos deseaua ver anteque muriese	935|936
1018	que je moreuisse!		
1019|1020	Mais comment l avez vos|puis fet	e como vos a ydo despues	937
1021|1022	?|Et il li dist Bien Dieu merci	que vos vi muy bien dixo lançarote merçed a dios señor dixo la donçella	938
1023	—		
1024	Et ceste part fet ele comment venistes vos	como vos auino de venir|asi contraesta parte	939|940
1025	qui avant ier vos en partistes	que aun tan poco|a que vos partistes demi	941|942
1026	? — Par foi fet il une grant acheison	por buena fee dixo lançarote|Por buena auentura	943|944
1027	m i amena	que me auino	945
1028|1029	Si li conte comment|I	e luego le Conto	946
1030|1031	chevalier o unes armes vermeilles l avoit apelé de traïson a la cort le roi Artu|por la mort de Meleagan;	como vn cauallero le Recto de traiçion enla corte del Rey artur Porla muerte de meliangas	947
1032|1033	si l en covient a deffendre en la cort le roi Baudemagu|Ha fet ele je sai bien	e heme a defender enla corte del Rey bandemagus ay señor dixo ella yo se quien es cauallero	948
1034	qui il est		
1035|1036	C est Argodras li Ros|et li chevaliers	Ca es argodras el Rubio hermano del cauallero	949
1037	que vos avés hui ocis	que agora matastes	950
1038|1039	et ars estoit ses freres;|si ne sai	mas señor no se	951
1040	que vos puissiés fere	que vos faga	952
1041|1042	kar se mes peres set|que vos aiés ocis Meleagan je criem qu il ne vos face ocirre	ca e miedo	953
1043	por le grant duel qu il avra des noveles	que si mi padre sabe	954
1044|1045	— Coment|? fet Lancelos nel set il mie encore	como matastes a meliangas	955
1046|1047	? — Certes sire nenil;|si est Meleagans en cest païs aportés plus a de XV	que vos faga matar porel gran pesar	956
1048|1049	jors|et est el chastel des Illl	que abra destas nuebas	957
1050	Pierres	como dixo lançarote no lo sabe	958
1051|1052	et le gardent iluec|si celeement	ansi me ayude dios dixo ella no maguer	959
1053	que li rois n en set encore riens:	que a quinze dias	960
1054|1055	si en covendra esploitier al plus sagement|que vos porrois	que an traido aesta tierra el cuerpo de meliangas	961
1056	Mes a	mas tienenlo enel castillo delas quatro piedras muy encubiertamente quelo no sepa su Padre	962
1057|1058	quant est li jors|que vos vos en devés deffendre	e ansi vos conuiene de vos encubrir muy sabiamente	963
1059|1060	?|Et il dist	mas quando es el dia	964
1061|1062	que c est le jor de la Magdalaine|Or vos en conseut Diex fet ele	que vos auedes de defender el dia dela magdalena dixo lançarote	965
1063	kar j ai grant poor	si dios me ayude dixo la donçella yo he gran miedo	966
1064	que Argodras ne vos face anui par traïson	que vos el faga matar algodras|por Alguna traiçion deso dixo lançarote no ayais Miedo	967|968
1065	— De ce fet il n aiés ja garde! Tot son pooir en face	e el faga todo su poder|Ca yo me guardare deGuisa	969|970
1066	que je n en avrai ja poor	Que no aya del pabor Conel ayuda de dios	971
1067	Assés parlerent cele nuit de maintes choses a	Asi fablaron toda aquella noche de muchas cosas	972
1068	et molt firent cil del chastel grant joie de lor dame qu il cuidoient avoir perdue	e Mucho façian gran alegria los del castillo|porque asi auian cobrado a su señora	973|974
1069	et or l ont saine	Que ayudauan ental manera Perder	975
1070|1071	et haîtie|Et al matin	e enla mañana en	976
1072	si tost com li jors parut cler se leva Lancelos	quanto el dia aparesçio claro se leuanto lançarote	977
1073	et se parti de la damoisele	e se partio dela donçella	978
1074	quant il fu armés;	e des|que fue armado	979|980
1075	et ele le commande molt a Dieu	e la acomendo a dios Señor dixo la donçella yo vos Ruego	981
1076	et li pria qu il s en revenist par li al repairier;	Que al tornar vengades|Por aqui de Grado dixo lançarote	982|983
1077	et il dist	si pudiere	984
1078	que si feroit il s il pooit		
1079	Si se remet en son chemin	e luego se metio enel camino	985
1080|1081	et eirre tot le jor jusqu al vespre|et lors aproche d une riviere	e andubo todo aquel dia porvna rribera ayuso fasta visperas	986
1082	que l en apeloit Aglonde		
1083|1084	si en estoit l eve molt parfonde|et molt noire	e el agua hera fonda y negra	987
1085|1086	Et quant il vint pres de l eve|si vit trois paveillons tendus pres de la rive;	e desque fue çerca del agua vio tres tiendas çerca dela rribera	988
1087	si en estoit li uns grans	e la vna hera muy grande	989
1088	et bials		
1089	et li autre dui estoient moien	e muy fermosa|e las dos heran	990|991
1090|1091	Et lors issi del greignor paveillon I|chevaliers tos desarmés	mas pequeñas	992
1092	qui li dist	e luego	993
1093	que bien soit il venus	que ay llego lançarote vio salir dela mayor tienda vn cauallero desarmado quele dixo señor vien vengades	994
1094|1095	et il li rent maintenant son salu|Ha sire fet il vos me samblés chevaliers errans	e lançarote le torno sus saludes buen señor dixo el cauallero dela tienda vosme semejades Cauallero andante	995
1096|1097	et je aim tos cels|qui en tel mestier usent lor vie	e porque ya fue tiempo	996
1098|1099	kar je meismes sui chevaliers errans|et por ce vos vueil je proier	que yo mesmo fui cauallero andante Ruego vos	997
1100	que vos herbergiés anuit mes o moi;	que esta noche aluerguedes Conmigo	998
1101	kar se vos passés avant de ci vos ne troverois se forest non	Ca si de aqui partides non fallaredes sino floresta muy yerma	999
1102	si salvages	e saluaje	1000
1103	que vos i porrois tost desvoier	que no fallaredes	1001
1104	Et il est bien tens de herbergier ce veés vos bien :		
1105|1106	por ce vos lo|que vos remanois	do aluergar esta noche	1002
1107	et vos avrois ostel bel	e poresto vosloaria	1003
1108	et buen tot a vostre voloir	Que finquedes aqui esta noche	1004
1109	— Bials sire fet Lancelos		
1110|1111	puis qu il vos plest je remaindrai|et por vostre proiere	e abredes muy buena Posada a toda vuestra voluntad buen señor dixo Lançarote yo fincare pues vos plaz Porvuestro Amor Pues dezides	1005
1112	et por ce		
1113	que vos dites		
1114	que vos estes chevaliers errans	Que fuistes cauallero Andante	1006
1115	a Lors descent		
1116|1117	et vaslés saillent des autres paveillons|si le desarment	e luego salieron delas tiendas escuderos Quelo desarmaron	1007
1118|1119	et li aportent I|mantel de samit legier a afubler	e desque fue desarmado Truxeronle vn manto de xamete	1008
1120	por le chaut	para cubrir Porla calor	1009
1121	qui grans estoit a;	que façia grande	1010
1122	si le mainent el grant paveillon avec l autre chevalier	e entonçe se entraron el cauallero	1011
1123	Et lors parlerent ensamble	e lançarote enla tienda	1012
1124	et s entracointierent	e asentaronse	1013
