368	Or dist li contes qu il fist grant chaut le jor	Asi como el cuento lo a deuisado Dize el cuento|que gran calentura façia el dia	348|349
369	que Lancelos entra en la forest de Sarpenic	que lançarote entro enla floresta	350
370	et por ce ne remest il mie qu il ne chevalchast jusqu à none;	mas poreso no finco|que el no andubiese todo el dia fasta nona	351|352
371	si li avint ensi qu il n encontra home ne feme jusqu al vespre;	que no encontro ome ni muger	353
372	mais lors sans faille	mas a hora de visperas sin falta	354
373	si com il dut issir de forest	quando queria salir dela floresta	355
374	qui tot le jor li ot duré encontra une damoisele	que todo el dia le auia durado encontro vna donzella	356
375	qui molt faisoit grant duel	que mucho façia gran duelo	357
376|377	et chevalchoit I|palefroi noir a molt riehe lorain	e andaua envn palafren morçillo	358
378	et a molt cointe sele de l'oevre d Engleterre	que traia vna muy Rica silla y freno	359
379	Il salue la damoisele	e el saluo la donçella	360
380	et ele lui	e ella ael donzella dixo lançarote deçidme|porque llorades	361|362
381	Damoisele fet il	si vos plaze çierto dixo la donçella|si yo supiese	363|364
		que me vernia Prouecho enello yo voslo diria muy de grado çierto dixo donçella enmelo deçir no aueredes vos daño	365
382	kar me dites s il vos plest	si auos pluguiere|e vos dezidmelo	366|367
		por conuenençia	368
		que vos ayude yo a todo mi Poder en todas las cosas	369
		que hubieredes menester	370
		e espeçialmente enesta	371
383	por quoi vos plorés	por que vos llorades	372
384|385	— Certes sire fet ele se je i' cuidoie avoir preu je le vos diroie|— Damage fet il ll i avrez vos ja se Dieu plest	Ca yo porne enello el mejor Remedio	373
386	mais dites le moi par covent que se je vos	que puede ser|si es cosa	374|375
387	puis aidier a vos esleecier je vos aiderai a mon pooir	que vos pueda ayudar Enel nombre de dios dixo la donçella pues vos os afincades tanto	376
388|389	donc le vos dirai je|ll est voirs	que vos diga enque manera es	377
390	que Meleagans li fiz al roi Baldemagu ala a la cort le roi Artu	e que cosa es lo	378
391	por la roine Genievre conquerre s il peust;	porque yo lloro yo voslo dire	379
392	et endementiers fist tant une damoisele	asi es|que fiço tanto vna donçella	380|381
393	qui estoit	Que hera hermana de Meliangas	382
394	? sa suer qu ele geta Lancelot d une tor ou Meleagans l avoit mis en prison ne sai	que saco dela prision a lançarote quelo tenia envna torre Meliangas no sabia	383
395	por quoi	porque e	384
396|397	Quant ele l ot delivré|si le tint avec li tant qu il fu garis	quando el fue libre ella lo tubo en su poder fastaque fue guarido	385
398	kar molt avoit eu mesaise en la prison	ca mucho auia enpeorado dela prision|e des	386|387
399	et puis l envoia a la cort le roi Artu ou il ocist Meleagan ce savons nos or bien	que fue guarido fuese ala corte del Rey Artur|e Mato alla a meliangas segund cuido	388|389
400	Mais si tost com li parent sorent qu ele avoit Lancelot osté de la prison	que oystes|mas tan ayna	390|391
401	si distrent qu ele l avoit fait	como sus parientes lo supieron	392
		que ella auia hechado dela prision a lançarote Dixeron quelo auia fecho	393
402	por Meleagan ocirre;	por amor de Meliangas delo matar	394
403	si le pristrent a force	e tomaronla afuerça	395
404	et l acheisonerent de sa mort	e pusieronla en prision|e dixeron	396|397
405|406	et distrent que s ele ne trovoit|qui l en desfendist	que si no fallare quien la defender de aquesto	398
407|408	qu'il feroient de lui justice|si grant com l en doit fere de cele	que farian della grand justiçia Como deuen de fazer de muger	399
409	qui son frere ocist	que asu hermano auia muerto	400
410	Et ele dist qu ele troveroit bien	e ella dixo	401
411|412	qui la desfendroit:|si mist jor d amener I	que bien fallaria quien la defendiese	402
413	chevalier	e luego pusieronle dia señalado Parase defender|Por cauallero	403|404
414|415	por li desfendre|si s est	e ella ymbio a buscar	405
416	puis porchaciee en Pluisors liex	por muchos lugares quien le defendiese	406
417	mais onques ne trova chevalier	mas nunca a podido fallar Cauallero	407
418	qui ses armes en osast prendre contre celui	que armas quiera tomar contra aquel Cauallero	408
419	qui apelee l avoit	que deste pleito la a Reptado	409
420|421	Or|si est tant la chose alee	e el Plazo se cumple Mañana ental manera	410
422|423	que li jors est aterminés a hui ;|si n a trové la pucele nul desfendeor	que si fasta ora de terçia no falla defensor tomaran della	411
424	et por ce dient li un	luego vengança	412
425	et li autre qu ele est atainte del meffet	e la vengança sera tal	413
426	que l en li met sus :	que la Quemaran	414
427|428	si l ont jugiee ce m est vis a ardoir le matin|et por ce qu il m en membroit or em ploroie je	e poresto lloro yo	415
429	si durement	asi tan fuertemente	416
430|431	kar certes ele estoit une des plus cortoises damoiseles ! del monde|et une des plus vaillans	porque aquella es vna delas altas donzellas del mundo agora me deçid donçella dixo lançarote	417
432	et s ele trovoit demain		
433|434	qui la deffendist|dont ne seroit ele quite del jugement	si ella fallase tras quien la defendiese seria ella quita del todo señor dixo ella no se	418
435|436	que l en a fet|? — Sire fet ele je ne sai	E es muy lexos de aqui ado ella esta dixo lançarote señor dixo ella no ay	419
437|438	—|Et est ce fet il gaires loing	mas de aqui alla de seis leguas ynglesas	420
439|440	que ele est|? — Sire	e si quisieredes Bien podedes yr alla a ora de Prima Ado la podre fallar dixo lançarote enla floresta de donseglorega dixo la donçella	421
441|442	fet ele il n i a que|VI	e este camino vos lleuara alla	422
443	lieues englesches		
444|445	Se vos leviés demain matin vos i seriés ains prime|— Ou le porrai je fet il trover	si lo supieredes guardar Pues a dios vos encomiendo dixo el	423
446|447	? — Al chastel a fet ele de Floego|et cis chemins vos i menra droit se vos le volés tenir	e luego se partio el vno del otro	424
448	— Or vos commant a Dieu damoisele fet il	e la donçella yua llorando	425
449	Si s em part atant		
450|451	et cele s en vet faisant son duel|Et il chevalche tant qu il vint fors de la forest	e la donçella yua agora tanto porsu camyno fastaque salio dela floresta	426
452	si vit devant lui une maison de religion	e llego avna casa de Religion	427
453	et il torne cele part	e el fue alla	428
454	por herbergier	por aluergar	429
455	Et quant il i vint		
456|457	si trueve a la porte IlII|des freres	e fallo ala puerta dos frailes	430
458	qui ja avoient chanté complie	que auian dicho conpletas	431
459	et estoient venu hors	e estauan al ayre	432
460	? al serain;		
461|462	si saillent encontre lui|por fere descendre	e ellos fueron contrael porlo ayudar a desçender	433
463	et dient	e dixeron	434
464	que bien soit il venus;	que vien fuese venido	435
465	si le font entrer laiens	e Metieronlo enel monesterio	436
466	et li demandent s il a mengié	e los frailes le dixeron señor auedes	437
467|468	et il dist|que nenil	oy comido no señores dixo el	438
469	et il font erraument mettre la table a	e luego mandaron ellos quele pusiesen la mesa	439
470	mais il dist qu il ne mengera devant qu il ait esté al mostier b lar il n i entra hui	mas lançarote no quiso|luego comer ante dixo	440|441
		que entraria enla yglesia	442
471	por orer	por fazer oraçion	443
472	et en ce qu il se fu agenoilliés	e desque el entro enla yglesia finco los ynojos	444
473	si regarde a destre	e el façiendo oraçion cato asu diestro	445
474	et voit unes prones d argent trop richement fetes a floretes d or	e vio vnos arcos de plata muy Ricamente fechos a flores de oro	446
475|476	et a oisials|et a bestes	e a bestias de diuersas maneras	447
477	et dedens avoit V		
478	chevaliers armés les hialmes es testes les espees es mains ausi apresté de deffendre	e ante ellos estauan çinco caualleros armados de todas armas elos yelmos enlas cabezas|e las espadas enlas manos	448|449
479|480	que se l en les volsist asaillir|De ce se merveilla molt Lancelos ;	como si quisiesen defender de algunos quelos quisiesen acometer Desto se marauillo mucho lançarote	450
481	si se drece erraument	e fue alla contraellos	451
482|483	et vet cele part|si salue les chevaliers	e ellos le dixeron señor bien seades venido	452
484|485	et il dient|que bien soit il venus	e el les rrindio sus saludes	453
486|487	Et il entre dedens les prones par un petit huisselet a|et esgarde les prones	e lançarote cato vn poco los arcos	454
488	qui tant sont riches qu il ne cuide pas	Porque heran muy Ricos|e muy fermosos	455|456
		que vien cuidaua	457
489	que nus rois les peust esligier;	Que vn Rey No los podia tales façer|e el	458|459
490|491	puis voit delés les chevaliers une tombe la plus riche|qui onques fust fete par home	asi Catando vio dentro enlos arcos vna muy Rica tumba qual nunca tal viera el ni ome del mundo	460
492	kar ele ert tote d or fin a chieres pierres precioses	que hera toda de oro fino|e de piedras preçiosas	461|462
493	qui molt valoient miels d un grant roialme	que estaua toda labrada de diuersas maneras	463
494	Se la tumbe fu de grant bialté nient ne monte la bialtés envers la richece	e de muy muchas cosas de figuras	464
495	dont ele estoit	e de otras cosas	465
496	et avec ce estoit ele la greignor	que tal tumba de tal manera nunca viera ni ome del mundo|que la non ouiese visto no podria asmar la fermosura	466|467
497	que Lancelos eust onques veue :	que enella auia de tales cosas|como enella estauan	468|469
498	si se merveille molt	e don lançarote se marauillo	470
499	qui puet estre li princes	e dixo entresi mesmo Quien podria ser el prinçipe	471
500	qui dedens fu mis	que enella yaçia	472
501	qui sont iluec	e lançarote pregunto alos caualleros|e dixo señores	473|474
502|503	Sire font il nos gardons le cors|qui en ceste tumbe est	que estades aqui façiendo señor dixeron los caualleros nos guardamos el cuerpo	475
504|505	qu'il n en soit portez fors de çaiens;|si somes	que yaze enesta tumba quelo no lleuen dende aqui	476
506|507	V|por garder le de jors par nuit en i a autres	e nos lo guardamos çinco caualleros de dia	477
508	V		
509|510	qui font autretel servise comme nos faisons de jors|—	e otros çinco de noche	478
511	Et por quoi fet Lancelos avez vos poor qu il n en soit portés	que no façemos y al Auedes miedo dixo Lançarote	479
512|513	? — Sire font il|por ce	que voslo lleuen de aqui señor dixeron ellos	480
514	que uns des freres de çaîens	si que vn fraile de aqui	481
515	qui molt est preudom	que mucho es buen ome	482
516	et de sainte vie nos dist n a encor gaires	e de sancta vida nos a dicho	483
517|518	que uns chevaliers vendroit ceste part|qui a force l en osteroit	que vn cauallero vernia aesta tierra	484
519	et fors de cest païs l en feroit porter	que por fuerça lo lleuaria desta tierra	485
520	Et nos gens de ceste terre voldrions miels morir qu il fust remués d entre nos :	e las gentes desta tierra querrian antes ser muertos|que el fuese lleuado de entre nos	486|487
521	por ce		
522	si le gardons issi com vos veez lar li preudom i nos dist	e poreso lo guardamos|asi como vedes	488|489
523	que li chevaliers ne demoreroit pas qu il ne venist — Or me dites	ca el ome bueno nos dixo|que no tardaria mucho el buen cauallero	490|491
524	fet Lancelos ne fu cil molt haus princes a cui l en fist	Que no viniese alo sacar Agora me deçid dixo lançarote quien fue este tan Rico prinçipe	492
525|526	si haute sepulture|? — Sire font cil haus hom fu il	que yaze entan rrica sepultura Señor Dixeron ellos Mucho fue alto ome	493
527	et riches; avec ce qu il fu haus hom fu il li plus preudom	e el|mas noble	494|495
528|529	qui onques fust a son tens|— Ha Diex fet Lancelos	Que nunca fue visto ay dios dixo lançarote quien fue señor dixeron ellos	496
530|531	qui fu il|?— Sire font il se vos conoissiés letres veoir le porriés	si sabedes leer vien podedes saber quien es	497
532	kar ses nons est escris el chief de cele lame	el que aqui yaze|que ala cabezera dela su tumba lo fallaredes escrito	498|499
533	Lors va Lancelos cele part	e lançarote se fue ala cabeça dela tunba	500
534	si regarde les letres	e fallo las letras	501
535	qui dient Ci gist Galehout li fiz a la Jaiande li sires des Lointaignes Isles a	que deçian aqui yaze galeote el fijo dela fermosa Jaiana	502
536	qui por l amor de Lancelot morut	que por amor de lançarote murio	503
537	Et quant il vit ce		
538|539	si chiet pasmés|et gist grant piece a terre sans mot dire;	e quando lançarote ovo las letras leydo cayo amorteçido en tierra	504
540	et li chevalier le corent relever	e estubo	505
541|542	si se merveillent molt qu il puet estre|Et quant il revint de pasmison	ansi gran pieça	506
543|544	si s escrie Ha las!|Quel dolor	que no pudo fablar	507
		e los caualleros fueron ael porlo leuantar	508
		e mucho se marauillauan	509
		que podia Aquello ser	510
		e quando lançarote acordo començo a dar vozes	511
		e a dezir ay	512
		que duelo	513
545	et quel damage	e que daño	514
546	Et lors fiert l un poing en l autre	e luego començo a dar del vn puño enel otro	515
547	et esgratine son viaire	e a rrascar el Rostro	516
548	si qu il en fet le sanc salir de totes pars	asi que la sangre le salia|por todas partes	517|518
549	si se prent as chevels	e a mesar sus fermosos cabellos	519
550	et se fiert grans cops del poing en mi le front	e a darse puñadas grandes enel rrostro	520
551	et en mi le pis	e enlos pechos	521
552|553	et crie|si durement qu il n i a celui	e a dar tales vozes	522
554|555	qui tote pitiés n en preigne;|si se laidenge	que todos auian piedad del	523
556	et maldit l ore qu il fu nes	e maldeçia el dia en|que fuera nasçido	524|525
557	et dit Ha Diex !	e deçia ay	526
558	Quel damage	que duelo	527
559|560	quel perte del plus preudome del monde|qui mors est	e que daño morir el mejor ome del mundo porel	528
561	por le plus vil chevalier	mas mal Cauallero	529
562	et por le plus malvés	e mas malauenturado	530
563	qui onques fust ! Tant fet Lancelos grant duel	que enel es Mucho fiço lançarote gran llanto|e daua tales vozes	531|532
564	que tuit cil de laiens le vienent regarder a merveille;	que todo el mundo lo cataua|e se marauillaua del	533|534
565	si li demandent	e preguntaronle	535
566	qui il est	como auia nombre	536
567	et il ne puet mot dire ains crie totes voies	mas el no podia Responder Ante daua vozes	537
568	et se debat	e gritos todavia	538
569|570	et descire|Quant il a son duel demené grant piece	e desque el fiço su duelo gran pieça cato las letras otra vez	539
571	si regarde les letres	e quando vio	540
572	qui dient	que deçia	541
573|574	que por lui est mors Galehout;|si dist	Que Porel hera Muerto dixo	542
575	que or seroit il trop malvés s il ausi ne moroit	que asaz seria mal auenturado|si porel no muriese	543|544
576	por lui:si saut maintenant jus des prones	e luego se partio dende	545
577|578	et pensa qu il iroit querre s espee|et qu il s en ocirroit	e fuese buscar su espada	546
579	kar ausi avoit ele esté Galehout a	para se matar conella	547
580|581	Et maintenant qu il fu issus del mostier|si encontra une des damoiseles del Lac cele	e luego el sabiendo Dela yglesia encontro con vna donzella dela dueña del lago aquella	548
582	qui a Boort avoit parlé devant le chastel de Honguefort	que fallo con Boores ante el castillo de ongeforte	549
583	et ele le conuit bien	e ella lo conoçio	550
584	si le prent par le pan de la cote	e trauole dela mano	551
585|586	et l areste|Qu est ce	e tirolo contrasi	552
587|588	? fet ele|Ou alés vos ensi	e dixole ado ydes vos	553
589	? — Ha damoisele fet il laissiés moi mes dolors finer lkar jamés n avroie joie ne repos en cest siecle	asi ay donçella dixo lançarote dexadme mis dolores acabar	554
590	— Parlés fet ele a moi	que jamas no abre plazer ni folgura eneste mundo fablad conmigo dixo la donçella	555
591|592	Et il ne li dit mot ains se lance outre|si qu il li eschape des mains	e el no le rrespondio palabra antese escapo dela mano	556
593	Et quant ele l en vit aler	e se fue	557
594|595	si li crie Je vos deffent fet ele par la rien|que vos plus amez en cest monde	e quando la donçella esto vido dixole señor yo vos defiendo porla cosa del mundo	558
596	que vos n ailliés avant	que mas amades|que no vaiades	559|560
597	tant que vos aiés parlé a moi	mas adelante fastaque fabledes conmigo	561
598|599	Et il s areste|si la regarde	e lançarote se detubo	562
600	et quant il la conut	luego e la cato tanto	563
601	si li dist	que la conoçio	564
602|603	que bien soit ele venue|En non Dieu fet ele vos me deuissiés fere plus bele chiere	e dixole donçella vien seades venida Pardios dixo ella vos deuedes fazer	565
604	que vos ne me fetes al mains	mas alegre cara de	566
605	por ce	Quanto façedes	567
606|607	que je sui messages vostre dame del Lac|— Ha damoisele fet il	Por quanto yo so mensaxera devuestra señora la donçella del lago dixo el non vos pese	568
608|609	por Dieu ne vos poist certes je ai tant de dolor|que nus for Diex ne me porroit conforter ne a ne cuidiés	ca no cuidedes	569
610	que jamés aie joie	que jamas aya yo plazer ni alegria	570
611	por aventure	por auentura	571
612|613	qui me puist avenir|— En non Dieu fet ele	que me venga Pordios dixo la donçella	572
614|615	si avrois|Escotez	si aueredes agora sabed	573
616|617	que ma dame vos mande|— Or dites fet il	que mi señora vos ymbia a deçir	574
618	que vos ostés le cors Galehout de caiens	que vos tiredes el cuerpo de galeote de aqui	575
619	et le fetes porter en litiere en la Dolerose Garde	e lo fagades lleuar al castillo dela dolorosa guarda	576
620|621	et iluec soit mis en la tombe meismes ou vos trovastes vostre non escrit;|et ele le velt ensi	e lo fagades meter en aquella tumba mesma ado fallastes su cuerpo escripto	577
622	por ce qu ele set bien	ca ella lo quiere	578
623	que en cel lieu sera vostre cors enterrez	ansi Ca el vuestro cuerpo mesmo sera y enterrado conel	579
624|625	Et quant il l ot|si en est molt liés	e quando el esto oyo fue muy alegre	580
626	et dist	e dixola	581
627	que molt li sont ces noveles plaisans	que Mucho heran aquellas nuebas plazenteras	582
628|629	kar tot ensi le fera il ;|puis demande comment sa dame le fet	que asi lo faria Puesque ella lo ymbiaua a mandar	583
630	Par foi fet ele ele a esté	Por buena fee dixo la donçella vien a ocho dias	584
631|632	VIlI|jors deshaitiee trop durement	Que vuestra señora esta muy triste	585
633	kar ele trova en son sort	porque ella vido ensus suertes segund	586
634	si com ele meismes me dist puis	que me ella dixo	587
635	que si tost com vos troveriés la tombe Galehout	que asi|como fallasedes la tumba de Galeote	588|589
636	que vos vos ocirriés de duel se vos n estiés destornez	que luego vos matariades sino ouiesedes quien vos esforçase	590
637	Por ce m envoia ele ça a grant besoing		
638	si vos mande	e quien vos estoruase	591
639	que vos laissiés le duel ester qu il ne vos puet fere se nuire non	e poresto me ymbio ella aca a gran priesa|e vos manda dexar este duelo	592|593
640	et vos prie par la rien	e vos Ruega|por la cosa del mundo	594|595
641	que vos plus amés	que mas amades	596
642	que vos al plus bel	que vos conortedes lo mejor	597
643	que vos porrois vos reconfortés	que pudieredes	598
644	et se vos ensi ne le fetes bien sachiés	e que|si lo no fiçieredes	599|600
645	que al premier besoing		
646|647	que vos avrois de li ele vos faudroit|Et il dist qu il se confortera	que ella vos tirara el ayuda	601
648	puis qu ele le velt	que della auedes	602
649|650	Or vos covient fet ele vos armes prendre|kar je voi bien qu il ne le vos en lairont mie en pes porter tant com il le porront deffendre	asi lo fare dixo lançarote puesque aella plaze agora vos conuiene dixo la donçella de armar	603
651	Et il dist qu il i morroit ançois qu il ne l ostast de laiens;		
652	si se vet armer	ca yo se bien	604
653	et la damoisele vient tantost as chevaliers	que aquellos caualleros no voslo dexaran llebar en	605
654|655	qui gardoient la tombe|si lor dist Seignor fet ele volés vos destorner ce qu il covient estre a force	quanto lo pudieren defender o yo morire dixo lançartoe o yo lo tirare donde esta	606
656	?	E luego se fue armar|e la donçella se fue alos caualleros quela tumba guardauan	607|608
657|658	et demandent|por quoi ele le dist	e dixoles señores queredes vos defender aquello	609
659|660	Je le di fet ele|por le cors	Que conuiene a ser afuerça yo lo digo dixo ella Porel cuerpo	610
661	que vos gardez	que guardades	611
662	et si savés bien qu il en sera ostez	ca sabed	612
663	— Non sera font il	que vos sera tomado non sera dixeron ellos en	613
664|665	que nos puissons|— En non Dieu fet ele	quanto nos pudieremos Pardios dixo ella	614
666	si iert	si sera	615
667	et bien sachiés fet ele		
668|669	que cil est venus|qui l en ostera	que aqui es venido quien voslo tolera	616
670	Et se vos le contredites vos en morrois tuit:	e si lo quisieredes contradeçir a todos conuiene morir	617
671	por ce vos vendroit il miels		
672	que vos le laississiés atant ains		
673	que vos vos en façois ocirre		
674|675	Et cil dient|que ja tant com il soient vif n en sera portés	e poresto querria quelo dexasedes anteque vos matasen porende ya enquanto nos fueremos vibos dixeron los caualleros No sera de aqui llebado	618
676	Et bien sache font il li chevaliers	e bien sepa el cauallero	619
677|678	qui venus est|por avoir le	que porel es venido	620
679	que s il estoit encore plus preus	que aunque fuese mejor ome	621
680|681	que Lancelos n est|si n en menra il point	que lançarote quelo no moueria de aqui vn punto agora vere dixo la donçella	622
682	— Or verrons fet ele comment il vos en avendra	como vos auerna Ellos	623
683	A ces paroles vint laiens Lancelos tos armés	asi fablando llego ay lançarote Armado de todas armas	624
684	et quant li chevalier le voient venir	e los caualleros|que lo vieron preguntaron	625|626
685|686	si li demandent qu il velt fere|Je vueil fet il avoir le cors	Que que queria fazer yo quiero dixo el el cuerpo	627
687|688	qui laiens est|— Par foi font il vos ne l avrois mie	que alla esta Pordios dixeron ellos vos no lo aueredes	628
689|690	por nient|Nos ¡ morrons ançois tuit	que ante seremos aqui todos muertos	629
691	que vos l enportois	que vos	630
692	— A morir fet il en estes		
693|694	donc tuit|puis que a mains ne vos en volés soffrir	asi lo lleuar a morir vos conuiene Dixo lançarote pues no vos queredes sofrir	631
695	Si saut dedens les prones		
696|697	et il li corent sus|kar arrieres le cuident fere sailir	e luego salieron los Caualleros delos arcos	632
698|699	por poor de morir;|si le fierent par la ou il le pueent ataindre	do estauan con miedo de ser Muertos	633
700	et il ot el poing l espee nue ;	e començaronlo a ferir|por do	634|635
701	si lor done grans cops	mas mal lo podian fazer	636
702	et pesans	e lançarote metio mano ala espada	637
703	et fiert le premier qu il encontre	e firio al primero|que fallo	638|639
704	si durement	asi duramente	640
705|706	que por le hialme ne|por la coife de fer ne remaint qu il ne li mete l espee jusqu al test;	que porel yelmo ni Porel almofar no finco quele no metiese la espada porla Cabeça	641
707|708	et il le hurte de soi|Si l abat a terre	e dio conel en tierra	642
709|710	Et lors saillent molt irieement tuit li autre|si depiecent son escu	e los otros lo començaron a ferir muy rreçia mente porel escudo	643
711	et son hialme	e porel yelmo	644
712	et son hauberc	e porla loriga	645
		asi que selo quebrantaron	646
713	et le blecent en pluisors lieus	e Ronpieron|Por muchos lugares	647|648
714	Mais il ne li chaut de rien qu il li facent	mas el no daua cosa	649
715|716	kar tant est dolens|que nus plus;	por aquello quele façian tanto estaua de sañudo	650
717	si lor laisse corre par grant ire	e dexo de correr aellos Con gran yra	651
718|719	et lor done de l espee|si grans cops	e dauales dela espada tales Golpes	652
720	que tos les fet guenchir avant lui	asi quelos façia de|si arredrar	653|654
721	Et lors esgarde celui des IllI	e Lançarote Paro mientes en	655
722	qui plus li faisoit mal	aquel que mas mal le façia	656
723	et cil estoit molt grans	que hera muy grande	657
724	et molt fors;	e muy fuerte	658
725	et Lancelos	e diole	659
		asi vn golpe tan grande ençima del yelmo	660
726	qui le vient ataignant li done par mi le hialme	que el fuego fiço salir del|e el golpe desçendio al honbro	661|662
727|728	si grant cop qu il en fet le feu saillir|et l espee glace	e Como fue dado de gran fuerça	663
729|730	qui de droit ne fu pas ferue|si descent desus la senestre espaule	asi que porla loriga no finco quele no derribase el braço conla espada en tierra	664
731|732	Li cops fu grans|et par ire ferus	e el cauallero conel gran dolor cayo	665
733	et bien i parut	luego en tierra amorteçido	666
734	que l espee cola par mi l espaule a al chevalier		
735|736	si que li bras a tote l espaule chiet desus le pavement|Et lors sont molt esmaié li autre troi	e los otros desque aquel golpe vieron fueron muy desmayados	667
737	si font molt malvés samblant d els deffendre	e fiçieron mal senblante dese defender porlos grandes golpes	668
738	por le grant cop qu il ont veu	que façia	669
739	et por l espee	e porla espada	670
740	que chescuns d els a ja sentie jusqu al sanc	que auia sentido cadavno enlas carnes	671
741	Et Lancelos lor cort sus	e lançarote no cato	672
742	et en fiert I	mas aquel|que derribo ante dio al otro vn tal golpe	673|674
743|744	el hialme|si qu il le fet flatir a terre d ambesdeus les paumes	por çima del yelmo quele fiço dar con anbas manos en tierra	675
745	Et quant li autre dui voient ce	e desque los otros esto vieron començaron a foir	676
746	si tornent en fuies vers l uis a garison;	por guaresçer	677
747	et Lancelos vint ataignant le deerrain	e lançarote alcanço	678
