1125	et demanda li uns a l autre de son estre	e començaron a fablar envno	1014
1126|1127	Li chevaliers enquiert a Lancelot|dont il vient	e el cauallero le pregunto	1015
1128	et ou il vet	e dixo señor	1016
1129	et quele aventure le maine	que auentura os lleba	1017
1130	si sol	asi solo	1018
1131|1132	et il li conte une partie de son estre|et autre l en çoile e;	e lançarote le conto toda su façienda enpero todavia le dixo	1019
1133	et totes voies li dist		
1134|1135	que en la cort al roi Baudemagu voldroit estre|por soi deffendre vers un chevalier	que yua ala corte del Rey bandemagus aque dixo el cauallero ame defender devn cauallero dixo lançarote	1020
1136	qui l a apelé de traïson	que me Recto de traiçion|e ellos	1021|1022
1137	En ce qu il parloient ensi orent li escuier mise la table	asi fablando entro vn escudero|e puso la mesa	1023|1024
		e asentose el cauallero a comer	1025
1138	si vont laver;	e lançarote	1026
		e vna donzella muy fermosa	1027
		que hera amiga del cauallero	1028
1139	si s asiet Lancelos	mas la donçella en|quanto vido a lançarote	1029|1030
1140	et li chevaliers	ansi lo cataua|que no se hartaua delo ver enque lo via tan fermoso	1031|1032
1141	et une damoisele	e no cuidaua	1033
1142|1143	qui molt ert bele|et estoit amie al seignor de laiens;	que tan fermoso ome pudiese auer enel mundo	1034
1144	si mengierent tuit troi ensamble	e asi lo estaua catando	1035
1145	mes cele	que no podia comer	1036
1146	qui Lancelot esgarde ne se puet saoler de lui veoir Kar tant li samble bials qu ele ne prisa onques mes bialté d ome envers cesti :	que auia el escudero tirado el primero manjar dela mesa|e ella no auia metido vocado enla voca	1037|1038
1147	si l esgarde		
1148	si viselment	e la donçella	1039
1149	que tot en laisse le mengier n a autre chose n entent	asi lo catando començo a pensar tan fieramente|que no hera sino marauilla	1040|1041
1150	fors a lui remirer	e ella	1042
1151|1152	Si ont li escuier osté le premier mes de sor la table c onques la damoisele n en tasta ains pensa totes voies|Et en cel pensé li descent el cuer une	ansi pensando cayo vn amor ensu corazon quelo començo	1043
1153	si grant amor qu ele aime Lancelot outre ce	ansi a amar a lançarote	1044
1154	que feme n ama mes home;	que mas muger podia a ome amar	1045
1155	si li est avis	e deçia entresi mesma	1046
1156	que s il l amoit qu'ele seroit beneuree	que si la el quisiese amar|que se ternia porla	1047|1048
1157	Mais ci endroit n em parole plus li contes lkar ça avant le devisera	mas bien auenturada muger del mundo|mas de	1049|1050
1158|1159	et comment ele l ama merveillosement|et comment ele le proia	como ella amo muy afincadamente a lançarote	1051
1160	et la merveille	e delas cosas	1052
1161	que ses amis en fist	que su amigo fiço	1053
1162	quant il sot qu ele l amoit	quando sopo|que ella tan desmesuradamjente lo amaua	1054|1055
1163	et comment cele morut	e de|como ella murio	1056|1057
		quando supo	1058
1164	por ce qu il la refusa tot ce vos trespassera li contes ci endroit	que lançarote no la queria amar todo lo dexa aqui el Cuento de contar	1059
1165	por deviser une aventure qu il lor avint el paveillon ou il estoient	Por contar vna auentura|que les auino enla tienda	1060|1061
1166	Ci dist li contes que	do estauan comiendo Dize el cuento	1062
1167	quant il orent le secont mes eu es vos un chevalier armé d unes armes vermeilles	que ellos estando comiendo|asi como vos digo he aqui	1063|1064
1168	qui vint corant par devant le paveillon o grant compaignie de chevaliers	por do viene|por antela tienda vn cauallero convnas armas vermejas con gran conpaña de caualleros	1065|1066
1169	Et cil as armes vermeilles	e el Cauallero delas armas vermejas	1067
1170	qui devant venoit entre el paveillon a	que delante venia entro enla tienda	1068
1171|1172	et voit|I	e vio vn escudero	1069
1173|1174	escuier|qui servoit a la table	que seruia antela mesa	1070
1175|1176	si estoit freres al chevalier de laiens|Et il cort maintenant cele part	e el cauallero enque lo vido fue contra el	1071
1177	si le prent par les espaules	e tomolo porlos braços	1072
1178	et le lieve devant lui sor l arçon de la sele	e pusolo antesi sobre el cuello del cauallo	1073
1179	si s en torne a tot	e salio conel dela tienda	1074
1180	Et quant cil del paveillon voit ce	e el cauallero quelo vio	1075
1181	si crie a Lancelot Ha bials sire je sui mors se cil enporte ensi mon frere	ansi lleuar començo a dar vozes a lançarote ay señor muerto so|si asi me lleba a aquel escudero mi hermano	1076|1077
1182	kar il l ocirra s il n est secors:	Ca lo matara|si lo no acorredes	1078|1079
1183	si vos pri	e porende vos Ruego	1080
1184	por Dieu	por dios	1081
1185	que vos i metés paine	que me ayudedes alo cobrar	1082
1186	Et Lancelos saut de la table	e lançarote salio|luego dela mesa	1083|1084
1187	et demande ses armes	e pidio sus armas a vn su escudero	1085
1188	et I	Que y estaua le dixo señor	1086
1189|1190	escuiers vint avant|si li dist Par foi sire vos armes	Por buena fee el cauallero vos a hecho llebar vuestras armas	1087
1191|1192	et vostre cheval enmainent il ! — Voire fet il|par mon chief ja	e vuestro cauallo pormi cabeza dixo lançarote ni	1088
1193|1194	por ce ne remaindra|que je nes sieve	por eso non fincara quelo non siga	1089
1195	et li chevaliers o lui	e luego salio lançarote dela tienda	1090
1196	et il esgarde cels	e el cauallero conel	1091
1197	qui s en vont	e vieron yr los caualleros pasando el agua Porvna puente de madero señor dixo lançarote al cauallero fincad vos aqui no fare dixo el	1092
1198	qui ja avoient passé l eve par J	mas antes yre con vos	1093
1199	pont de fust;	fasta que falledes quien vos de armas	1094
1200|1201	et Lancelos demande al chevalier s il remaindra|Sire fet il nenil ains vos ferai compaignie	e cauallo enque sigades el cauallero	1095
1202	tant que nos aions trové	Luego se començaron de yr	1096
1203	qui armes vos baut		
1204|1205	Lors acueillent lor voie tot a pié|et vienent au pont	e andubieron tanto fastaque llegaron ala puente de madera	1097
1206	si passent outre	e pasaronla	1098
1207	et s adrecent a I	e fueronse contravn otero	1099
1208	tertre par ou li chevalier s en vont;	Por do los caualleros se yuan	1100
1209	si n ont gaires alé	e lançarote	1101
1210|1211	quant il encontrent I|chevalier armé d unes armes noires	e el cauallero fueron tanto enpos ellos fastaque encontraron vn cauallero armado devnas armas negras	1102
1212|1213	qui venoit al pont par I|chemin de travers	que venia ala puente porvn sendero pequeño altrabes	1103
1214|1215	Et quant il voit Lancelot|si s areste	e quando el vio a lançarote	1104
1216	por ce		
1217	que bien le conoissoit	luego lo conoçio	1105
1218	si li demande ou il vet ensi a pié tos desammés	e estovo quedo fastaque llego	1106
1219	Qui estes vos sire chevaliers fet Lancelos	e dixole señor|do ydes	1107|1108
1220	qui me demandés ou je vois	asi de pie|e desarmado	1109|1110
1221|1222	? — Je sui fet il I|chevaliers d estrange païs	e quien sodes vos dixo lançarote yo so dixo el vn cauallero destraña tierra	1111
1223	mais molt me merveil de ce	que mucho me marauillo	1112
1224	que je vos voi ensi aler	porque vos veo yr	1113
1225	Et Lancelos li conte comment il estoit herbergiés		
1226	et comment I	asi e apie	1114
1227	chevaliers vint laiens ou il menjoit	e lançarote lo conoçio	1115
1228	qui prist a force I	e començole a contar	1116
1229|1230	vaslet|et le mist sor le col de son cheval	como el cauallero lo aluergara	1117
1231	Et encore m a il plus meffet fet Lancelos	e como el otro les llebo el escudero	1118
1232	kar cil	que ala mesa seruia afuerça ençima del cauallo	1119
1233|1234	qui avec lui vindrent enporterent mes armes|et enmenerent mon cheval a —	e como le fiço llebar sus armas	1120
1235	Quel guerredon fet cil porroie je atendre de vos se je	Que galardon me daredes dixo el cauallero	1121
1236	por vos me desarmoie		
1237	et vos bailloie mes armes	si vos diese mis armas	1122
1238|1239	et mon cheval|? — Certes fet Lancelos tel com vos deviseriés	e mi cauallo porçierto dixo lançarote tal qual vos supieredes deuisar	1123
1240	— Se vos fet il el premier lieu ou je vos troverai armé	si vos me juraredes dixo el Cauallero|que enel primer lugar	1124|1125
1241	por que je soie desarmés me creantés a doner vos armes ¡e vos bailleroie les moies	que vos fallare armado|e yo fuere desarmado me dedes vuestras armas yo vos dare estas mis armas	1126|1127
1242|1243	— Certes fet Lancelos|si ferai je	e mi cauallo Muy de grado dixo lançarote ental	1128
1244	por que vos ne me truisiés combatant	que me non falledes conuatiendo	1129
1245	Et cil descent maintenant	e luego selo juro	1130
		entonçe desçendio el cauallero desu cauallo	1131
1246	si se desarme	e desarmose	1132
1247	et baille a Lancelot tot son hernois	e dio todas sus armas|e su Cauallo a Lançarote	1133|1134
1248	et il s en appareille	e Lançarote se armo	1135
1249	et monte en son cheval	e subio enel cauallo	1136
1250	puis dist a son oste qu il s en retort; Imes il dist	e dixo asu huesped	1137
1251	que non fera	que se tornase No fare dixo el huesped	1138
1252	Si ferois fet Lancelos a lar je conoistrai bien les armes a celui	si faredes dixo lançarote|que yo conoçere vien el cauallero enlas armas	1139|1140
1253	que je vois querant en quelque lieu je les truisse	que lleba en qualquier lugar	1141
1254|1255	Et cil dist|puis qu il velt s en retornera:	que el vaya yo me tornare dixo el huesped pues vos plaz	1142
1256	si s en vet	E luego se torno	1143
1257	et enmaine o lui le chevalier	e llebo consigo el cauallero quelas armas auia dado a lançarote	1144
1258	qui molt est liés de ce	que yua muy alegre de aquello	1145
1259|1260	que Lancelos li doit I|guerredon	que lançarote le auia prometido	1146
1261|1262	Et Lancelos aquelt son chemin aprés cels|que	e lançarote se fue porel camino enpos el cauallero	1147
1263	? il sieut tant qu il est venus el tertre en haut	e andubo tanto|fasta que paso porel otero	1148|1149
1264	et lors voit devant lui la forest	e llego avna floresta	1150
1265	que l en apele la forest des Trois Perilx	que llamauan la floresta delos tres pilares	1151
1266	et ce	e porque fue ella	1152
1267	por quoi ele fu ensi apelee devisera bien li contes ça avant	asi llamada este cuento lo deuisara aca adelante	1153
1268	Quant il fu amont el tertre	Quando el llego ala floresta	1154
1269|1270	si esgarde devant lui|mais il ne voit nul de cels	e no vido aquel enpos quien yua	1155
1271	que il queroit	e fue	1156
1272|1273	kar il s estoient ja ferus en la forest|Et totes voies sieut il les esclos des chevals	entonçe porende muy triste	1157
1274|1275	tant que il vient a l entree de la forest;|et lors encontre une damoisele tote chenue	entonçe encontro vna donçella envn muy fermoso palafren	1158
1276	qui chevalchoit molt cointement	que hera toda cana	1159
1277	et estoit tote deslie ses treces par ses espaules comme pucele	e lleuaua los cauellos tendidos porlas espaldas|como si fuese muy moça	1160|1161
1278|1279	et avoit en son chief l|chapel de roses	e traia vn capillejo de Rosas enla cabeça	1162
1280	kar c estoit entor la Saint Johan	Ca hera|entonçe por sant juan	1163|1164
1281|1282	Il le salue|et ele li dist	e lançarote lo saluo	1165
1283|1284	que bone aventure li doinst Diex|Damoisele fet il me savriés vos a dire	e ella lo torno sus saludes Donçella dixo lançarote saberme yades enseñar	1166
1285	quel part uns chevaliers o unes armes vermeilles s en vet	por do va vn Cauallero devnas armas bermejas	1167
1286	? — En non Diex fet ele je le vos enseigneroie bien se je voloie	Por dios dixo ella yo voslo enseñare bien|si quisiere dezidme dixo lançarote	1168|1169
1287	— Dites le moi fet il par covent	Por tal conuenençia	1170
1288	que je soie vostre chevaliers el premier lieu ou vos me requerrois	que yo sea vuestro cauallero enel Primer lugar	1171
1289	— Se vos me creantés fet ele	que me rrequerades Si vosme jurades dixo la donçella	1172
1290	que vos me sievrois de	que vayades conmigo	1173
1291	quel hore	luego enla ora	1174
1292	que vos en semoigne je le vos enseignerai	que vos llamare yo voslo mostrare	1175
1293|1294	Et cil li creante|dont il se repenti	e lanzarote lo juro	1176
1295|1296	puis molt durement tel hore fu|Or alés fet ele tot cest chemin	luego donde el se arrepintio despues muy duramente tal ora fue Vos yredes poreste camino dixo la donzella	1177
1297	si li mostre I		
1298|1299	sentier estroit|qui aloit al travers de la forest	fasta que falledes vn sendero atrauieso dela floresta	1178
1300	Si ne tornés fet ele de nule part	e entonçe tomaredes aquel sendero	1179
1301	et quant vos avrois alé entor demie lieue	e desque hubieredes porel andado	1180
1302|1303	si verrois delés I|vivier trois paveillons tendus	quanto vna legua fallaredes antevn nogal tres tiendas Armadas	1181
1304	La dedens troverois le chevalier	e enla vna dellas fallaredes el Cauallero	1182
1305|1306	que vos querés|que l en apele Arramant le Gros;	que buscades aque llaman aramante el grueso	1183
1307|1308	si le conoistrois a ces enseignes qu il a en mi le front II|plaies	e vos lo conoçeredes porestas señales en medio dela frente ados llagas agora vos podedes yr	1184
1309	Or vos en poés aler		
1310	mais que vos m aiés dit vostre nom	mas anteme deçid|como auedes nombre	1185|1186
1311	Et il se nome molt a envis	e el se nombro mucho amidos	1187
1312	et totes voies li dist qu il a non Lancelot del Lac	e dixo yo he nombre Lançarote del lago Lançarote se partio	1188
1313	Alez a Dieu fet ele	luego dela donçella	1189
1314	et s en vet tot le chemin qu ele li avoit enseigné	e fuese Porel camino|que ella hauia mostrado	1190|1191
1315	si grant aleure com il plus puet del cheval traire	e yua tan apriesa|quanto el cauallo podia andar	1192|1193
		e andubo	1194
		asi fasta	1195
1316|1317	tant que il atainst les chevaliers|que il sievoit	que alcanço los caualleros depos quien yba	1196
1318|1319	Et cil lor i escrie|si haut	e el les començo a dar vozes de	1197
1320	que bien porent oîr	quanto vido|que le podian oyr	1198|1199
1321	et maintenant li vient acorant li uns d eus l escu al col le lance el poing	e luego vino contrael vno delos caualleros el escudo al cuello	1200
1322	et fu armés de totes armes	e la lança enla mano armado de todas armas	1201
1323	Et Lancelos le fiert	e lançarote lo yryo	1202
1324	si que pour le hauberc ne remaint qu il ne li met par mi le cors le fer del glaive	asi tan duramente|que porel escudo ni porla loriga no finco quele no metiese la lança pormedio del cuerpo	1203|1204
1325	si l empaint bien com cil	e dio conel gran cayda en tierra Como	1205
1326|1327	qui assés ot|et cuer	aquel que hera de Gran fuerça	1206
1328	et force:		
1329	si le porte del cheval a terre		
1330	et retrait son glaive a lui;		
1331|1332	si voit I|autre venir tot appareillié de joster	e Luego vino otro contrael aparejado de Justar	1207
1333|1334	et il nel refuse pas ains li torne le chief del cheval|et cil	e lançarote no Rehuso ante boluio la Cabeza del cauallo alla	1208
1335	qui vint acorant li done tel cop en l escu	do lo vyo venir|e el cauallero lo firio	1209|1210
1336	que tote sa lance vole en pieces	ansi que su lança le quebro En medio del escudo	1211
1337	Et Lancelos	e lançarote lo hirio	1212
1338	qui un poi porta sa lance bas	ansi vn poco baxo	1213
1339	l'ataint par desus l arcon de la sele a	asi ençima del arçon dela silla	1214
1340	si le fiert		
1341|1342	si que les mailes del hauberc ne pueent soffrir le grant cop|que li glaives ne li voist par mi le cors	asi quela loriga no lo pudo defender quela lança no le metiese pormedio del cuerpo	1215
1343	si que li fers pert d autre part;	asi que la Lança paresçio dela otra parte	1216
1344	si l empainst	e Dio conel	1217
1345|1346	si durement qu il le porte a terre|et lui	e conel Cauallo envno en tierra Mucho se Marauillaron los otros Caualleros desto	1218
1347	et le cheval	e dixeron	1219
1348	Et lors dient cil		
1349	qui devant s en aloient		
1350	que molt joste bien li chevaliers quant	que mucho Justaua bien el Cauallero	1220
1351|1352	Il|de lor meillors compaignons a ensi abatus	Que dos delos mejores Conpañeros auia derribado	1221
1353	Et Lancelos laisse corre a els tos	e lanzarote se lanço|entonçe entre ellos	1222|1223
1354	qui encore estoient nuef;	que heran veinte	1224
1355	si ot l espee traite	e el conla espada enla mano	1225
1356|1357	por ce|que ses glaives estoit brisiés al chevalier qu il ot derrainement abatu ;	que la lança hera quebrada	1226
1358	si lor detrenche lor escus	e començo a derribar escudos	1227
1359	et lor depiece lor hialmes	e a cortar yelmos	1228
1360	et lor ront les haubers sor les bras	e lorigas ençima de braços	1229
1361	et sor les espaules;	e de espaldas	1230
1362	si fet tant par sa proesce	asi que tanto hizo Porsu proeza	1231
1363|1364	que tuit cil|qui le voient s en merveillent	que quantos lo vian se marauillauan ende mucho	1232
1365|1366	Et la ou il voit le chevalier as armes vermeilles|si nel mesconoist pas ains li adresce par mi els tos	e Quando vido el Cauallero delas armas vermejas ende endereço contrael	1233
1367	et li done	e dixo esperad Cauallero	1234
1368|1369	si grant cop par mi le hialme|que cil est	e diole vn tal golpe dela espada de toda su fuerça sobre el yelmo	1235
1370	si estordis qu il ne se puet es arçons tenir ains vole a terre	que dio conel en tierra estendido	1236
1371|1372	Et Lancelos li va par desus le cors a cheval|tant que cil pert la vertu	e traxo al cauallo tantas vezes sobre el quelo dexo medio muerto	1237
1373|1374	et la force tote a|Et lors sont li autre molt esmaié	e quando los otros caualleros esto uieron fueron muy escaidos	1238
1375	kar bien cuident	Ca bien Cuydauan	1239
1376|1377	que cil soit mors|qui lor sires estoit;	que su señor hera muerto	1240
1378	si se metent en paine del vengier	e metieronse en auentura de muerte lo vengar	1241
1379	et corent sus a Lancelot tuit ensamble	e dexaronse yr ael muy determinadamente|e lançarote	1242|1243
1380	Mais il nel truevent pas	que desto no se espanto ni vn poco	1244
1381|1382	si esbahi qu il ne soit tos pres de soi deffendre;|si lor abandone son escu	Ca bien se cuydaua defender baldonaua a todos su escudo	1245
1383|1384	et tient l espee|dont il lor done grans cops par la ou il les ataint ne onques	e daba tales Golpes consu espada	1246
1385	por pooir qu il aient ne li porent tolir terre ains se met par mi els maintes fois		
1386	quel gré qu il en aient	Que aquel	1247
1387	Et de tant li avient il bien qu il n aconsieut chevalier a droit cop qu il ne face s espee sentir en char nue ou il nel port del cheval a terre:	que alcançaua aderecho golpe le fazia sentir la espada enla carne desnuda|e daua conel del cauallo en tierra	1248|1249
1388	si lor esrache les escus des cols	e les quebranto los yelmos enlas cabeças	1250
1389	et les hialmes des testes		
1390	et lor decoupe poins	e les cortaba piernas	1251
1391	et bras a	e braços|e	1252|1253
		asi que quanto alcançaua todo lisiaba	1254
1392	et se hurte en els de cors	Que delos golpes dela espada	1255
1393	et de cheval ;	que delos Pechos del caballo	1256
1394	si en a V	e asi abia los çinco a tales partido	1257
1395|1396	si atornés qu il gisent a terre|si conreé qu il n ont pooir de relever	que non podian bollir pie ni mano tales yazian en tierra	1258
1397	Quant li autre voient ce	e quando los Caualleros vieron las marauillas de armas|Que el façia	1259|1260
1398	si lor est avis que s il i demorent plus il n em pueent eschaper sans morir	luego vieron queles conuenia morir|si mas ay porfiasen	1261|1262
1399	et por ce s enfuient al plus tost qu il pueent vers la forest ou il la voient plus espesse	entonçes començaron todos a fuir contrala floresta ado vian la mayor espesura	1263
1400	Et Lancelos ne les sieut mie granment ains retorne al chevalier qu il ot abatu celui as armes vermeilles	Quanto los cauallos los podian llebar Mas lan çarote no los quiso seguir|mas antes se fue al cauallero delas armas vermejas	1264|1265
		que auia derribado	1266
1401|1402	kar il voldra savoir|qui il est	Por saber quien hera	1267
1403	Et quant il i est venus	e quando lançarote ay llego	1268
1404	si trueve l escuier	luego fallo el escudero	1269
		que ante el estaua enla tienda	1270
1405	que il queroit	que auia tomado	1271
1406	que on avoit mis sor I		
1407	roncin a les mains liies triés le dos	e estaua envn rroçin las manos atadas atras	1272
1408	et vient a lui	e fue	1273
1409	si le deslie	luego alo desatar	1274
1410|1411	Et quant il se sent delivrés|si li chiet as piés	e el escudero enque se vio libre hecho sele alos pies	1275
1412	et le mercie de Dieu ;	e agradesçio mucho a dios	1276
		porque asi lo auia librado	1277
1413	et Lancelos descent	e lançarote desçendio del cauallo	1278
1414	si li baille son cheval a garder	e diolo al escudero	1279
1415	puis vet al chevalier	e fuese al cauallero	1280
1416	qui ja s estoit relevés en son seant	que estaua ya ensu acuerdo|e se Reuoluia porse leuantar enpero estaua aun atordido	1281|1282
1417	si estordis qu il ne veoit gote	que no via ni aun gota	1283
1418|1419	Et Lancelos li esrache le hialme de la teste|si felenessement	e lançarote quitole el yelmo dela cabeça tan rreçio	1284
1420	que cil flatist à terre des paumes	que dio conel en tierra delas manos	1285
1421	et de tot le viaire;	e delas Rodillas	1286
1422	si saine del nes	e al arrancar desollole las narizes	1287
1423	et del front trop durement	e la frente|que la sangre le hizo ende salir muy fieramente	1288|1289
1424	Et Lancelos dist qu il l ocirra s i ne se tient	e dixole|si te no tienes	1290|1291
1425|1426	por outré;|et cil est	por vencido yo te matare	1292
1427	si esmaiés a qu il ne li puet respondre ains gist pasmés adens	e el cauallero estaua atal quele no podia rresponder|e asi estaua amortesçido	1293|1294
1428|1429	Et Lancelos le redrece|si le trueve	e lançarote catolo	1295
1430	si ensanglenté qu il cuide bien	e fallolo todo sangriento|e bien cuydo	1296|1297
1431	que il soit mors	que hera muerto	1298
1432	et lors se repent de ce	e mucho se arrepintio	1299
1433	que tant li avoit fet mal;	porque tan mal lo auia fecho	1300
1434	si s asiet les lui	e tirose del todo	1301
1435	por veoir	por verlo	1302
1436	que il fera	que aria	1303
1437	Et ja se relevoient troi de cels	e los tres caualleros|que ante derribara començaronse a Reboluer	1304|1305
1438|1439	qui a terre avoient geu|et Lancelos lor laisse core	e lançarote enquelo vido fue alla	1306
1440	et dit	e dixoles	1307
1441	que mort sont	si vos no tenedes|por vençidos yo vos matare	1308|1309
