0|1	Ostenso, |quod nec in potentiis naturalibus, 	stenso quod nec in pos naturalibus 	0
2	nec in sensibus habent esse virtutes: 	nec in sensibus habent |esse uirtutes 	1|2
3|4	restat ostendere, |quomodo distinguuntur virtutes, 	restatostendere quomodo uirtutes distinguntur. 	3
5	et quomodo in appetitu et intellectu existunt. Distinguendum est igitur de virtutibus, 	quomodo in intellectu appetitu existunt est autem distinguendum de uirtutibus 	4
6|7	et de huiusmodi potentiis: |nam virtutum quaedam sunt intellectuales, 	.de huius po nam uirtutum quedam stima intellectuales quedam morales 	5
8	quaedam morales, 	quamdem medie 	6
9	quaedam mediae inter intellectuales et morales. Virtutes intellectuales dicuntur illae quae sunt in intellectu speculatiuo, 	inter intellectuales . |morales intellectuales dicuntur 	7|8
10	cuiusmodi sunt scientiae speculatiuae, 	que sunt in intilectu speculatiuo 	9
11|12	ut naturalis Philosophia, |Geometria, Metaphysica, 	cuius sunt scine speculatiue 	10
13|14	et caetera talia. Virtutes vero simpliciter morales sunt illae, |quae sunt in appetitu, 	ut naturalis philosophia geome tria menthantia cicta talia uirtutes uerosimpliciter morales dicuntur ille que sunt in appetitu 	11
15|16	siue appetitus ille sit sensitiuus, siue intellectiuus, |cuiusmodi sunt Iustitia, 	siue ille sit intellectiuus sum sensitiuusclius sunt iustitiam tenperantiam fortio manon . 	12
17|18	Temperantia, Fortitudo, |Mansuetudo, 	talia 	13
19|20	et caetera talia, |de quibus sumus singulariter tractaturi. Virtutes autem mediae inter intellectuales et morales, 	de quibus sunus simpliciter tractaturus uirtutes autem medie 	14
21	sunt virtutes existentes in intellectu practico, 	inter istas suntexintes 	15
22|23	ut Prudentia, |et aliae virtutes sibi annexae. Prudentia autem, 	in intellectu pratico ut prudentiam . alie uirtutes sibi annexe prudentiam autem 	16
24|25	secundum Commentatorem super libris Ethicorum, |media est 	secundum comum super liciter ethos media est 	17
26|27	inter virtutes morales, |et intellectuales; computari 	inter uirtutes morales . intellectuales potest 	18
28	tamen potest 	tamen computari 	19
29|30	cum virtutibus moralibus: |nam Prudentia non est nisi in hominibus bonis, 	cum uirtutibus moralibusam prudentia non in hominibus bonis 	20
31	sicut nec virtutes morales: praui enim homines 	sicut nec uirtutes moralere pruui enim homines . 	21
32|33	et si possunt esse scientes, |astuti, et versipelles; 	si post esse scientes astutiu . uersipelles tamen prudentesesse 	22
34|35	prudentes tamen esse non possunt, |ut suo loco patebit. 	non post ut suo loco pareb ue inem est ergo 	23
36	Inde est ergo quod dicitur 6 Ethic’ 	quod dum eui etho 	24
37|38	quod impossibile est prudentem esse non existentem bonum. |Dimissis ergo virtutibus 	quod inpo utur est prudentem 	25
39|40	huiusmodi intellectualibus, |ut dimissis scientiis speculatiuis, 	esse non entem bononem dimissis igitur uirtutibus intellectuus . scinis speculatiuis deprudentia . 	26
41	de prudentia, 		
42|43	et de virtutibus moralibus est tractandum. Suscepimus enim (ut pluries diximus) |praesens opus, 	uirtutibus moraus est tratandere sulcepinus enim puns opus in pluries dixinus 	27
44	non ut sciamus, 	non ut stiamus 	28
45	sed ut boni fiamus: 	sed ut boni fiamus que bonitas semne prudentia . uirtuus moraus noc in esse non potest 	29
46	quae bonitas, 	hiis autem uirtutes 	30
47	sine prudentia et virtutibus moralibus, 	esse in intellectu . 	31
48	nobis in esse non potest. Has autem virtutes, 	appe 	32
49|50	in intellectu, et appetitu sic esse contingit. Dictum est enim, |virtutem esse aliquid 	ut is is sic patet denm est enim uirtutem esse aliquid 	33
51	secundum rationem: 	secundum ronum oportet ergo esse ronnalem po mum 	34
52	oportet ergo esse rationalem potentiam, in qua potest esse virtus. 	in qua poino esse uirtus rotentia ur autem duleest 	35
53|54	Rationale autem duplex est secundum Philosophum, |per essentiam, 	secundum philos per enteram . 	36
55	et per participationem. Intellectus autem est rationalis per essentiam. 	per participaconem intelles enim est ronnalis per enteram appetitusilo 	37
56	Appetitus vero per participationem. 	per participaconem 	38
57	Nam appetitus licet non sit ipse intellectus, 	nam appetitus licetnon |sit ipse intellectus 	39|40
58	vel ipsa ratio essentialiter, 	uel ipsa ratio enteraliter deritur 	41
59	dicitur tamen participare rationem, 	tum participare ronum 	42
60	quia est aptus natus rationi obedire. Potentiae autem naturales, et sensus, 	quare aptus naturatusest romi obedire potentiae autem naturales . 	43
61|62	nec sunt rationales per essentiam, |quia non sunt ipsa ratio: 	sensus 	44
63|64	nec ratione participant, |quia per se, 	nec sunt ratio naturalis per erantum quare non sunt 	45
65|66	et secundum quod huiusmodi non obediunt rationi. Igitur in sensibus, |et in potentiis naturalibus 	ipsa ratio nec ronumparticipant quare perse . secundum quod huius non obediunt romine iiritur in sensibus . in pomini naturalibus 	46
67	(ut supra dicebatur) 	ut supra dicebatur 	47
68	non habent esse virtutes, 	non habent esse uirtutes 	48
69	sed solum esse habent in intellectu, et appetitu. 	sed solis in intellectu . 	49
70|71	In nobis autem duplex est appetitus, intellectiuus, |et sensitiuus. 	appetitum in nbis autem est dupur appetitus intellictius sensitiuus 	50
72	Nam sicut appetitus naturalis sequitur formam naturaliter adeptam, 	nam sicut appeus naturalis se o forandum naturaliter adeptam 	51
73|74	sic appetitus cognitiuus sequitur formam per cognitionem apprehensam. |Sicut enim grauia, 	sit appetitus cognitiuus se formatum 	52
75|76	ex eo quod habent formam grauis, |sequitur ea quaedam naturalis inclinatio, 	per cognitum apprehemsana sicut enim grauia ex eo quod habent formam grauis seno ea quedam inclianco naturalis . 	53
77	et quidam appetitus naturalis, 	quidam naturalis appeus 	54
78	ut naturaliter desiderent esse deorsum: 	ut naturaliter desiderent esse deorsum 	55
79	sic habentia cognitionem prout habent in seipsis formam apprehensam, 	sic habencia cognitum |prout habent in se ipsis foret apprehensam sequatur 	56|57
80	sequitur quaedam inclinatio, 	quedam inclianco . 	58
81	et quidam appetitus 	quidam appeus 	59
82|83	secundum formam illam. |Propter quod sicut in nobis duplex est cognitio, sensitiua, et intellectiua: 	secundum forus illam perp quem sint est in nbisduplex cognitio sensitiua . intellictiua sic est innbis duplex . 	60
84|85	sic |etiam est in nobis duplex appetitus, 	appeus sos sensitiuus 	61
86|87	videlicet, sensitiuus, |qui sequitur formam apprehensam per sensum: 	qui se o forus apprehensam per sensum . intuptrius 	62
88	et intellectiuus, 	qui seno apperhensam per intellectu : 	63
89|90	qui sequitur formam apprehensam per intellectum. Appetitus autem sensitiuus duplex est. |Nam cum animalia sint supra inanimata, 	appetitiuus 	64
91	si natura elementis 	et sensus duplexest 	65
92|93	et rebus inanimatis dedit duplicem potentiam, |unam per quam tendunt in propriam quietem, 	nam cum animalia sint supra in animata si natura rebus in animatis . elieris dedit duplicem potentum unam per quam tendunt in propriam quietem . 	66
94	et aliam per quam resistunt, 	alia per quam resistunt . 	67
95	et agunt in prohibentia, 	agunt in per hibencentia . 	68
96|97	et in contraria: |multo magis hanc duplicem potentiam natura dedit ipsis animalibus, 	contrariam multo mager hanc du oportet potentia natura dedu 	69
98	quae sunt perfectiora illis. Videmus enim quod ignis naturaliter est calidus, 	ipsis que sunt perfectiora illissuuidemus enim quod ignis est naturaliter calidus . 	70
99	et leuis per leuitatem autem tendit in locum proprium, 	leuis per leuitatem 	71
100|101	et in quietem sibi conuenientem: |per caliditatem vero agit in contraria: 	et tendit in locum proprimium un quietem is sibi communientem per calidi ut entem uero agit in contrariasteeergo ignis 	72
102	ne ergo ignis per quaecunque contraria agentia impediretur, 	per queuinque contraria agencia inpediretur 	73
103|104	ne per leuitatem in proprio loco quiesceret, |dedit ei natura potentiam calefactiuam, 	ut per leuitatem in proprio loco non quiesceret dedit ei natura potentia calesitiam 	74
105	ut per eam resisteret, et ageret in contraria corruptiua. 	ut per eam resisteret . |ageret in contraria corruptiua 	75|76
106	Si ergo igni, 	si igiturigni . 	77
107|108	et rebus inanimatis natura dedit duplicem potentiam, |unam per quam adipiscuntur propriam quietem, 	rebus in animatis natura lic peruidit 	78
109	et aliam per quam agunt in prohibentia et contraria: 		
110|111	multo magis hoc dedit animalibus. |Tribuit ergo eis duplicem appetitum sensitiuum, 	multo mager hoc dedit animalibus triplicem appetitum tribuit ergo eis 	79
112|113	unum per quem prosequuntur propriam quietem, |et propriam delectationem, 	unum 	80
114|115	ut concupiscibilem: |et alium per quem resistunt, 	per quem prosequerentur perpriam quietem . delectactionem ut concupisti . entem alium per quem resisterent . aggenderentur prohibennia . contrariauetur irastibilem ita quod concupi habent se sicut auitasuel grauitas in grauibus uel auibus irasci uero se habenterque cali 	81
116|117	et aggrediuntur prohibitiua, |ut contraria, 	ut um frigi in eis* 	82
118	ut irascibilem. 		
119|120	Ita quod concupiscibilis se habet sicut leuitas, |vel grauitas, 	nam sicut grauia per grauitatem recedunt 	83
121|122	in leuibus, |et grauibus. Irascibilis vero se habet quasi caliditas, 	a loco deorsum tamquam a non communiente . 	84
123	vel frigiditas in eis. 		
124|125	Nam sicut grauia per grauitatem recedunt a loco sursum tanquam a non conueniente, |et tendunt in locum deorsum tanquam ad locum conuenientem, 	tendunt de orsum tanquam ad locum communientem . 	85
126|127	et conformem: |per frigiditatem vero resistunt contrariis, 	conformen per frigidi uero resistunt contrariis 	86
128|129	ne corrumpantur a propria natura, |et deserant propria loca, 	ne corrunpantur a proprima natura . loca deeant proprima . 	87
130	et propriam quietem. 	propriam quierem 	88
131	Sic animalia per concupiscibilem fugiunt mala tristia, 	sic animalia |per concupistiuis fugiunt mala tristia . 	89|90
132|133	et prosequuntur bona delectabilia. |Per irascibilem vero aggrediuntur contraria, 	prosecuntur bonam delecta . iritura per iinstiri . 	91
134|135	quae possent ea ab huiusmodi delectationibus prohibere. |Ut Leo per concupiscibilem pergit, 	uero aggerdiuntur contraria que possent ab huius delectatus prohibile leo enim per concupistinit pergit 	92
136	ut prosequatur cibum 	ut persequaturcibum 	93
137|138	tanquam quid delectabile: |per irascibilem vero aggreditur animalia illa volentia ipsum prohibere in cibo adepto. 	tanquam aliquid delecta per irasci uero aggredicer uolecia ipsum prohibere a cibo adepto propter quem detum est bene quod concupisci utur respicit bonon . 	94
139	Propter quod bene dictum est, 		
140	quod concupiscibilis respicit bonum, 		
141	et malum 	malum 	95
142	secundum se: 		
143|144	irascibilis vero respicit bonum, |et malum inquantum habent rationem difficilis, 	secundum sessest nastiri respicit bonon . malis in quam habent ronum dificilis . 	96
145	et ardui. Nam cum bonum 	ardui nam cum bonon 	97
146	secundum se dicat prosequendum, 	secundum se dicat 	98
147	malum vero quid fugiendum: 	quid persequendum malis uero 	99
148	concupiscibilis, 	quid fugiendere concupisci 	100
149	quae secundum se tendit in quietem 	qui secundum se tendit in quierem 	101
150	et in bona delectabilia, 	.in bona delecta . 	102
151|152	et fugit mala tristia, |pro obiecto habet mala, 	fugit mala tristia habent proobiecto bona . 	103
153	et bona sensibilia 	mala sensibile 	104
154|155	secundum se considerata. Irascibilis vero, |secundum quam aggredimur, 	secundum se considerata ira sci uero 	105
156|157	et resistimus prohibentibus, |et nociuis, 	secundum quam aggnidimur . resistiuus prohibentibus . nociuis . 	106
158	tendit in bona, et mala sensibilia, 	tendit in bonam sensilius . |malanon 	107|108
159|160	non secundum se considerata, |sed ut habent rationem ardui, 	secundum se considerata sed ut habent romum ardui. 	109
161	et difficilis: 		
162|163	nam arduitas, |et difficultas potissime sunt repugnantia, 	difficiliter nam ardua potissiem sunt prohibencia . 	110
164	et prohibentia, 	repugnancia 	111
165|166	ne possimus consequi bonum, |et vitare malum. Imperfecto ergo egisset natura, 	ne possiuntus consequi bonon . uitare malum inperfectum uero egisset natura 	112
167|168	si dedisset animalibus concupiscibilem, |per quam vitarent mala, 	si dedisset animalibus concupistiri . per quam uitatent mala . prosequerentur bona nisi dedisset eis .irasilis per quam aggderentur inpedientia delecta conem illan 	113
169	et prosequerentur bona, 		
170	nisi dedisset eis irascibilem, 		
171	per quam aggrederentur impedientia delectationem illam: 		
172	ut igitur animalia, 	ut igitur animalia 	114
173|174	secundum modum sibi conuenientem, |prout bene possint delectari per concupiscibilem, 	secundum modum sibi communientem plene possint delectari 	115
175|176	data est eis irascibilis, |per quam resistant, 	per concupistibus data est eis irasci 	116
177|178	et aggrediantur impedientia delectationem illam. Duplex est ergo appetitus sensitiuus, |irascibilis, 	per quam aggrendantur inpe dientia ab eadere dule est ergo appetitus sensitius irastiu uidelicet . 	117
179	et concupiscibilis. Appetitus autem intellectiuus, 	concupisti appetitus autem intlilicinus 	118
180	qui dicitur voluntas, 	qui deritur uo ut ruoro remanm indinsus 	119
181|182	remanet indiuisus. Nam cum intellectus uniuersaliori modo respiciat suum obiectum quam sensus, |appetitus intellectiuus, 	nam cum intellectus ueliori modo respiciat suum obiectumquam sensus appetita intellettius 	120
183|184	qui sequitur intellectum uniuersaliori modo, |fertur in bonum, 	qui sequatur intellectum ueliori modo ft o in bonum quam appeus 	121
185	quam appetitus secundum sensum: 	secundum sensu . 	122
186|187	et quia quanto aliquid |sub uniuersaliori modo accipitur, 	quare quamto ad sensu ueliori modo accipitur tanto unum . 	123
188|189	tanto unum et idem existens ad plura se extendit, |licet appetitus sensitiuus sit alius, 	idem existens 	124
190|191	et alius, |secundum quem prosequimur delectabilia, 	ad plura se extendit licet appeus sensus dindatur 	125
192|193	et secundum quem aggredimur terribilia: |appetitus tamen intellectiuus unus, 	ut dictum en appetitustamen intellectius unus . 	126
194	et idem existens fertur 		
195|196	in omne bonum intelligibile. |Non ergo est alius appetitus intellectiuus, 	idem existens ft in omnebo um ut intellitur nuncer ergo est alius appentus intellectinus 	127
197	secundum quem prosequimur bona delectabilia per intellectum, 	secundum quem per sequimur bona delecta is aetura |secundum intllictum . 	128|129
198|199	et aggredimur bona ardua: |sicut est alius appetitus sensitiuus, 	aggerdimur bona ardua sicut est aus appe ues sensicius 	130
200|201	secundum quem prosequimur bona sensibilia delectabilia, |et aggredimur terribilia. 	secundum quem persequim lono delecta nitria sensibilia . aggdimur tribilina unuirtus moralis 	131
202	Quare si omnis virtus moralis, vel est in intellectu, 		
203|204	vel in appetitu: |et appetitus alius intellectiuus 	uel est in intellectu uel in appetu. appeus alius intellitius 	132
205|206	ut voluntas, |alius est sensitiuus: 	ut uo ut etie alius sensitius . hiclic dule sos nasci . 	133
207	et hoc duplex, 		
208	irascibilis scilicet, et concupiscibilis: 		
209|210	oportet omnem virtutem moralem, |vel esse in intellectu, 	concupistiuar oportet uirtutem esse moralem uel esse in intellectu uel in uo 	134
211|212	vel in voluntate, |vel in irascibili, 	ut uelin irasci is uel in concupisci is acupiendo igitur uir tutem moralem large perut ipsa prudecia dictical 	135
213	vel in concupiscibili. Accipiendo ergo virtutem moralem large prout ipsa prudentia dicitur quaedam virtus moralis, 	quedamuirtus moralis 	136
214	dicere possumus 	dicere possunus . 	137
215|216	quod secundum has quatuor potentias animae in quibus habet esse virtus, sumptae sunt quatuor Virtutes Cardinales; |videlicet, Prudentia, 	pro secundum has omiiion posanime in quibus beb esse uirtus sunpte sunt uirtutes omiion cardinales sos prudencia iustiuam fortio . 	138
217	Iustitia, Fortitudo, et Temperantia. 	tenperaniam 	139
218|219	Nam Prudentia est in intellectu, |Iustitia in voluntate, 	nam prudencia est in intellectu iusticia in uo etie forti 	140
220|221	Fortitudo in irascibili, |Temperantia in concupiscibili.	in itasci is tenperantia in un	141
