0	— Naie par foi fist Joseph ains sui crestiens	Padre	0
1	et croj el Pere	e uno Spirito Santo	1
2	et el Fiz	si è una cosa	2
3	et el Saint Esperit; n a fors un Dieu	e non v à fõrse uno solo lddio|	3|4
4	et cil est	si possente	5
5	si poissans qu il puet fere les mors a resusciter	che può fare gli uomini risucitare da morte a vita	6
6	et de cels	e di quelli	7
7	qui ont esté malvés	ch ânno stati malvagi	8
8	et desloials puet il fere buens	e disleali può elli fare buoni	9
		e diritti	10
		né nullo non è tanto peccatore	11
9	et droituriers ne nus n est tant pecheor se il s acorde a lui qu il ne le face venir al desus de tos ses I anuis	s elli s acorda con lui|ch elli nol faccia venire al di suso de' suoi animici	12|13
10	Et il a bien mostré voiant vos tos qu il est Diex	E elli à ciò ben mostrato|vegendone tutti	14|15
11	et puissans sor tos autres ne a la	ch egli è lddio possente sopra tutti gli altri	16
12	puis sance de lui ne se puet nus pooirs prendre	né alla possanza di lui non|si può nulla cosa aguagliare	17|18
13	et ce poés vos bien veoir par ces ymages	; 'e ciò potete vo' ben vedere per queste immagini	19
14	que vos clamiez diex	che vo' chiamate lddio	20
15	et en cui vos creez qu il a	in cui vo' crede'|ch egli à	21|22
16	si acraventés	si isfracelati	23
17	et afondrés qu il sont tuit ars	e fenduti|che sono tutti arsi	24|25
		—Certo	26
		disse Mategranz	27
18	— Certes fet Mategrant je voi bien qu il est assés plus puissans	io veggio bene|ch egli à assa' più possanza	28|29
19	que je ne cuidoie	ch io non credeva	30
20	et se il raisoit	e s e' facesse	31
21	tant que mes freres fust resuscités	tanto che mio fratello fosse risucitato	32
22	si qu il parlast a moi jamés ne croiroie en autre dieu se en lui non	sicch elli parlasse a me|giamai non crederei in altro lddio se none in lui	33|34
23	Quant Joseph or ce	Quando Giuseppo udi ciò	35
24	que Mategrant disoit	che Metagranz diceva	36
25	si s agenoille a terre	sissi inginocchiò in terra	37
26	et dist Diex	e disse|Al	38|39
		bel dolze Sire lddio	40
27	qui estoras le monde	che criasti el mondo	41
28	qui feis la lune	e facesti	42
29	et le soleil	e l sole	43
30	et les	e la luna	44
31|32	III|elemens	e quatro alimenti	45
33	qui deignas nestre de la Virge pucele	e che degnasti nascere della Vergine Pulcella	46
34	qui fus pendus en la sainte Crois	e che fosti messo nella Santa Croce	47
35	et te laissas escopir	e ti lasciasti scopare	48
36	et batre	e battere	49
37	et ferir as felons Juis	e fedire a' fellon Giudei	50
38	et volsis goster de la mort	e volesti gustare della morte per tuo popolo ricomperare di pene dello inferno	51
39	por ton pueple raiembre des paines d enfer sire ensi vraiement com tu resuscitas de mort ensi faces i tu miracle de cest mort apertement voiant tos cels	insi veracemente come tu risucitasti da morte|insi facci tu miracolo di questa morte	52|53
		apertamente vegendo tutti quelli	54
40	qui ci sont	che qui sonos	55
41		Allora|si dirizò Giuseppo	56|57
42	et aprés ce ne demora gueres	e apresso ciò non dimorò guari	58
43	que li mors se leva de terre sains	che l morto|si levò di terra Sano	59|60
44	et haitiés	e atato	61
45	et cort cele part ou il voit Joseph;	e corse in quelle parti ove vide Giuseppo|;	62|63
46	si li baisse les piés	si gli baciò|e piè	64|65
47	et dist	e disse	66
48	si que tuit l entendent Veez ci le saint homme	sicché tutti lo ntenderono|Vedete qui el santo huomo	67|68
49	qui despendi le fiz Dieu de la vraie crois	che levò el figliuolo di Dio della Verace Croce	69
50|51	et Dieus l a envoié entre nos|por ce	e Dio l à mandato intra voi per ciò	70
52	que vos soiés baptisié lkar autrement ne poés vos eschaper de la pardurable mort d enfer	che voi siate battezati|e altrimenti non potete voi scampare la perdurabile morte di ninfernos	71|72
53	Quant Joseph vit le mort resuscité	E quando Giuseppo vide el morto risucitato	73
54	si plora de pitié	si pianse di pietà	74
55	et mercia Dieu de buen cuer;	e rendé gratie a Dio di buon cuore	75
56	si dist a cels	e disse a coloro	76
		che ntorno lui erano	77
57	qui entor li estoient Seignor or poés vos bien dire	: Signori|or potete vo ben dire	78|79
58|59	que cil de cui je vos al parlé est Diex|et puissans sor tos autres	che quello lddio di cui io vo ò parlato est lddio possente sopra tuti gli altris	80
		— Certo	81
		disse Mategranz	82
60	— Certes fet Mategrant c est voir ne jamés ne creirai en autre Dieu	ciò è vero|né giamai non crederò in altro lddio	83|84
61	que en lui	che in lui	85
62	kar je sai bien des qu il a Argon mon frere resuscité qu il est Diex sans per	ch i' so bene|da ch'egli à Agon mio fratello risucitato	86|87
		ch egli è tutto possente	88
		Atanto	89
		si lasciano tutti quelli della piaza cadere a' piè di Giuseppo	90
		e dissono ad alte boci	91
63			92
64	et distrent a haute vois Sire nos nos metons del tot en vostre conseil; se nos avons par mescreance foloié ça en arieres nos somes prest de lamendier a vostre los ne jamés ne ferom rien	no' no mettiamo del tutto in vostro consiglio|; ue noi abiamo per miscredenza fallato qua in adietro noi siamo presti dello amendare a vostro lodo	93|94
		né giamai non faremo nulla	95
65	qui encontre vostre volenté soit	che contro a vostra volontà sia	96
66|67	Enseigniés nos|quel loi nos devom tenir		97
68|69	et en|quel maniere	e n quale maniera	98
70	et nos la tendrom	: noi la terremos	99
71	Ensi furent cil del chastel converti		100
72	et baptisié	e battezati	101
73	Et quant li seneschals	E quando il siniscalco	102
74	qui avoit feru Joseph par mi la cuisse vir	che avea fedito Giuseppo per me la coscia vide	103
75	que tuit se crestienoient	che trastutti cristiniavano	104
		si confessò	105
76	si reconuit oiant tot le pueple comment il avoit feru Joseph	udendo tutto el popolo|com elli avea fedito Gioseppo	106|107
77	et comment l espee estoir brisiee	e come la spada era rotta	108
78	et je cuit fet il	E i' credo|diss elli	109|110
79	que vos en troverois l autre moitié en sa cuisse	che vo' vi troverete l altra rotta nella coscia	111
80			112
81	si troverent l espee;	si trovarono la spada	113
82	et quant virent ce	e quand	114
83	si en furent molt esmaié;	e vidono ciò furono molto ismagati|si disse Mategranz	115|116
84	si dist MategrantSire comment portois vos garir	|come potrete voi guarire	117|118
85	? — Bien se Dieu plest fist Joseph	? — Bene|se Dio piace	119|120
		disse Giuseppo	121
86	mais vos serois avant sanés de la plaie de vostre chief	; ma voi sarete inanzi sanato della piaga divostro capos	122
87	Lors fist aporter le remanant de l espee ou le pont	eAllora|si fece aportare el rimanente della spada ove el pome	123|124
88	et le heut estoit	e l elsa era	125
89|90	si fist le seigne de la crois sor la plaie Mategrant|et ele fu tantost garie	si vi fece el segno della santa croce sopra la piaga di Maternanz ed e' fu tantosto guarito	126
91	Puis traist hors de sa char la piece de l'espee	Poscia trae fuori di sua carne la spada	127
92	qui dedens estoit; mes trop se merveillierent tuit cil		
93	qui la virent	e l apicca	128
94	kar au retraire n issi de la plaie gote de sanc	: allora furono tutti per lo castello cristiani	129
95|96	et l espee estoit|si clere	Si visse poi Argons otto giorni	130
97	et si blanche qu il sambloit c onques ne fust en char entree De ce se merveilla tos li pueples		
98	et quant Josepf fint les ll	e quando Giuseppo	131
99	moitiés del brant		
100	si dist Ha espee jamés ne seras soldee devant		
101	que cil te tendra a ses mains		
102	qui les hautes aventures del Graal devra asso mer;		
103	mais si tost com il te tendra		
104|105	si rejoindras a force|Et cele partie	si parti del castello	132
106	qui en ma char entra ne sera jamés veue nule fois		
107|108	que sanc n en isse|tant que cil	si ritenono là entro la spada	133
109	qui la soudera la tiegne		
110	Ensi jura loseph de l espee		
111	et lors furent par le chastel crestienez	e la guardarono in gran carità “tanto	134
112|113	Si vesqui|puis Argon VIll	ch io la conquisi a molto gran pena	135
114	ans;	; s	136
115	et quant loseph se parti del chastel		
116	si refindrent laiens l espee		
117	et la garderent a grant chierté		
118	tant que je la conquis oan a molt grant paine		
119	Et bien sachiés	e ben sapiate	137
120	que je i oi molt grant travail ains	ch i' v ebbi molto gran travaglio inanzi	138
121	que l euisse par devers moi;	ch io l avessi	139
122	et puis	e poscia	140
		ch io l ebbi	141
123	que je l oi vos di je bien qu ele ne fu traite del fuere iors orendroit:	vo dich io bene|ch ella non fu tratta del fodero forse oraindiritto	142|143
		Si lla porto tutto giorno con esso meco	144
		perch io credo	145
124	si la port aventure trover celui	per alcuna strana aventuTa|trovare colui	146|147
125	qui la rejoinsist	che lla risaldasse	148
126	et mesmement de yos avoie je grant espoir	Medesimamente di voi avea io grande speranza	149
127	que vos la rejoin¬ sissiés	che voi la rigiugnesse	150
128|129	kar il n est encore de nul chevalier|si grant parole come de vos;	ché non è ancora di nullo cavaliere trasi gran parola come di voi	151
130	et quant vos i avés failli je ne sal	;|e quando vo' v avete fallito	152|153
131	qui í puisse recovrer	io non so a cui mi possa ricoverare	154
132|133	Or avés oi|por quoi ele saine t	Ora avete udito perch ella sanguina	155
134|135	por quoi je port ll|espees	e perch io porto due pade	156
136|137	Et savés vos|por quoi je m agenoillai devant li	E sapete voi perch io m inginocchio davanti lei	157
138	? le m i agenoillai		
139	por ce	? Per ciò	158
140	que ¡e sai bien qu'ele est sainte	ch io so bene|ch ella est santa cosa	159|160
141|142	kar par|si seront achevees es aventures del saint Oraal	e che per lei fieno acivite l aventure del Santo Gradale	161
143	et maint miracle en ai e veu	e molti miracoli n ô io veduti poscia	162
144	puis que je la portai premierement	ch io la portai primieramente	163
145		— E perché	164
146	Et por quoi fet Hestor le baisastes vos	disse Astor|la basciaste voi	165|166
147|148	? —|Por ce fet il	? — Per ciò	167
		diss elli	168
149	que le jor	che giorno	169
150	que je le baise ne recevrai je mortel plaie;	ch io la bacio non riceverò io mortale piaga	170
151	et quant je dis ore a mon seignor Gauvain qu il m avoit de mort rescos ne me menbroit il pas de l espee	e quando dissi ora a monsignor Galvano|ch elli m avea di morte riscosso non mi ricordava elli passo niente della spadas	171|172
152	— Or me dites fet mesire Gauvain comment vos avés non	— Or mi dite|dice monsignor Galvano	173|174
		come voi avete nome	175
		— Certo	176
153	— Certes fet cil j ai non Eliezer	disse elli|i' ô nome Eliezer	177|178
154	si sui fiz al Riche Roi Pescheor	si son figliuolo del Ricco re Pescatore	179
155	qui tient le saint Graal en sa maison	che tiene il Santo Gradale in sua magione	180
156	—	— E	181
157	Et qu aliés vos querant	che andate voi cheggendo in questo paese|?	182|183
158	? fet mesire Gauvain	disse monsignor Galvano	184
159	— Certes iet cil je vos aloie querant	— Certo|disse Eliezer	185|186
		io voi andava cheggendo per la maraviglia di questa spada mettere a fine	187
160	por ceste espee Ejoindre har je cuidoie bien	e risaldare questa brisciatura|ch io credeva bene	188|189
161	que vos n'i fausissiés pas;	che voi non vi fallaste	190
162	et puis	; Pe poscia	191
163	que vos i avés failli je cuit bien	che voi v avete fallato|io credo bene	192|193
164	que chevaliers n i aviegne mes a piece	che cavaliere non ciaverà mai in pezza	194
165		ll me— Or vo dirò io|disse monsignor Galvano	195|196
166	que vos lerois	che vo farete	197
167	ll est voirs	: egli è vero	198
168	que nos somes meu en la queste del nellor chevalier del monde	che noi siamo movuti in chesta per lo miglior cavaliere del mondo	199
169	dont nos ne savons rien yil est mors ou vis	donde noi non sapiamo s egli è morto o s egli è vivo	200
170	et por ce vos loeroie je en droit conseil	e perciò vo loderei io in diritto consiglio	201
171	que vos venissiés avec nos	che voi veniste con esso noi	202
172	tant que nos l euissons trové ou loing ou pres se trovez puet estre	tanto che noi l avessimo trovato|o lungi o presso	203|204
		se trovar	205
		si puote	206
			207
173	Et ¡t sai bien qu'il achevera ceste aventure se mortels proesce í puet avoir mestier	ch elli accivirà questa aventura|se mortal prodeza vi può avere mestieri	208|209
174	— Ki est cil fet li chevaliers	— E chi è colui|disse el cavaliere	210|211
175	que vos dites	che vo dite	212
176	qui tant est de haute proesce	che tanto est d alta prode za	213
		? — Ciò êl	214
177	? — Cest fet il mesire Lancelos del Lac	disse monsignor Galvano|Lancellotto de Lago	215|216
178		el figliuolo del re Bando di Benoic— sePer mia fé|disse quelli	217|218
		in vostra chesta non mi metterò io mica	219
179	kar Fres al pas le crgé ams men iel la	ch io non ò passo el comiato|anzi me n andrò là dond io vegno	220|221
180	dont je nui; mes se vos le trovés nul lieu	; vma se voi el trovate in nullo luogo	222
181	si li poés dire	si gli potete dire	223
182	que s il velt ceste espee veoir	che s elli vuole questa spada avere	224
183	si viegne tot droit chiés le Riche Roi Pescheor lkar iluec porra il l espee trover	si vegna tutto diritto a casa el Ricco re Pelles|ché nel luogo potrà elli questa spada averes	225|226
184	Et lors les commande a Dieu	Allor gli comanda ardDio	227
185	si s en vet entre lui	e se ne va sua via intra lui f	228
186	et la pucele	e sua pulcella	229
		che molto era bella cosa a vedere	230
187	et l escuier	e lo scudieri	231
188	et mesire Gauvain se depart de ses compaignons	ME monsignor Galvano|si diparte da suo compagnoni	232|233
189	si aquelt son chemin tos sols	si accoglie suo camino tutto solo	234
190	et chescuns des autres fet autretel	e ciascuno degli altri fanno altrettale	235
191	Mes ore se taist li contes d els tos		
192	et parole d Agloval premierement Or dist li contes que		
193	quant Agloval fu partis de ses compaignons qu il erra tot le jor entier sans aventure trover		
194	qui face a amentevoir		
195	Et la nuit iut en la maison a un hermite molt preudome		
196	qui son pooir fist la nuit de lui aaisier a		
197	L endemain se leva matin		
198	et erra totes voies		
199	et ensi cercha la forest		
200	et de Ionc		
201	et de lé		
202	tant que ce vint al cinquime jor qu il vint un poì devant vespres en I		
203	estroit sentier		
204	Et lors encontra I		
205	chevalier acorant sor		
206|207	I|cheval	eMa or	236
208	et fu armés de totes armes mes ses escus estoit detrenchiés amont		
209|210	et aval|et ses haubers ros	si tace atanto el conto di lor tutti	237
211|212	et desmailliés|et ses hialmes depeciés	e parla d Aglovalle primieramente	238
213	et escartelés ;		
214	et li sans li degote de la teste		
215	et des bras	giuso	239
216	si que li haubers en estoit tos vermels e		
217	Et quant il vit Agloval		
218	si vint vers lui al plus tost qu'il pout		
219	et a li dist Ha gentils chevaliers aies merci de moi ne me laisse ocirre devant toi ! — Sire fet Agloval je ne voi encore nul		
220	qui mal vos weille fere		
221	— Bials sire fet cil vos le verrois par tens lar aprés moi vient ne sai quels chevaliers		
222|223	qui me velt ocirre|et por noient	ché più nol vuole richiedere a cavallo	240
224	et si m'a il ja navré com vos poés veoir		
225	— Or ne vos esmaiés ret Agloval mes laissiés le venir tot seurement		
226	si l atendés		
227	et je vos creant loialment		
228	que vos n i avrois ja mal sans moi		
229	; A ces paroles se regardent		
230	et voient I	per ciò	241
231	chevalier venir		
232	si grant aleure com li chevals le puet aporter b		
233	Sire fet li chevaliers a Agloval veés le ci		
234	Et il point maintenant vers lui quanqu il puet del cheval traire ;		
235	et cil li torne la teste de son cheval		
236	quant il voit		
237	que cil li vient a l encontre e;		
238	si s entreñerent		
239	si durement		
240	que li escu n ont duree qu il ne soient percié as fers des lances a		
241	Li chevaliers brise sa lance a l encontrer		
242	et Agloval le fiert	ch elli era a piè	242
243	si durement qu il porte lui		
244	et le cheval a terre		
245	Mes cil		
246	qui molt estoit pros se relieve erraument		
247	et trait l espee		
248|249	et gete l escu sor sa teste|si fet grant samblant de soi deffendre	:	243
250	Et Agloval li cort sus tot ensi com il estoit armés		
251	si a le fiert		
252	si del pis del cheval qu il le refet voler a terre		
253	Et lors descent jus lkar plus ne le velt requerre a cheval		
254	por ce qu il estoit a pié;		
255	si atache son cheval a un arbre	si atacca suo cavallo a uno albero	244
256	puis trait l espee	poscia prende sua spada	245
257	et cort sus al chevalier; mes il le trueve	e corre suso al cavaliere|ma elli el truova	246|247
258	si atorné	si atornato	248
259	que cil n a pooir de soi relever de la ou il gist	che non à podere di sé rilevare di là ove giace	249
260	et il li esrache le hialme de la teste	Ed|e li arappa l elmo della testa	250|251
261	et li abat la ventaille	e gli batte la ventaglia	252
262	et dist qu il li coupera le chief s il ne se tient	e dice|che gli colperà el capo se non	253|254
263	por outré	si tiene per oltrato	255
264	Et cil oevre les iex	Ed egli apre gli occhi	256
265	qui assés estoit a mal aise e;	che molto era misatato	257
266|267	et quant il voit l espee|dont cil li velt le chief couper	e quand e' vede la spad onde quelli il minaccia di colpare il capo	258
268	si a poor de mort	si à paura di morte	259
269	et crie merci	si grida mercé|Al	260|261
270	Ha frans chevaliers fet il ne m ociés mie lkar ie me tieng	franco cavaliere|diss elli	262|263
		non m uceidete mica	264
271	por outré;	ch io mi tengo per oltrato|;	265|266
272	et veez ici m'espee	e vedete qui mia spada	267
273	que je vos rent	ch io vo rendos	268
274	Et Agloval la reçoit		269
275|276	et puis li demande|por quoi il voloit le chevalier ocirre	; poscia el domanda perch elli voleva el cavaliere uccidere	270
277	Par foi fet il	Per ciò	271
278	por ce qu il ocist avant ier un de mes escuiers ne soi	ch e' m uccise l altrieri uno mio scudiere	272
279	por quoi:	si non so perché	273
280	et por ce l oceisse je volentiers se j en fuisse venus al desus	; aperciò l avessi io volentier morto|s i' ne fossi venuto al di sopra	274|275
281	Et al desus en venisse je par tens se je ne vos euisse encontré a	e al di sopra ne fossi io per tempo venuto|s i' non voi avessi incontrato	276|277
		—Per fé	278
282	— Par foi fet Agloval vos feissiés trop grant desmesure	disse Aglovalle|voi areste fatto troppo grande crudeltà	279|280
283	quant por I		
284|285	escuier occissiés I|chevalier	ché per uno scudiere volavate uccidere uno cavaliere	281
286	et por cest outrage weil je b	E per questo oltraggio voglio	282
287|288	que vos vos en metois en sa merci|et je vos cuit orendroit moi	che vo' vo mettiate in sua mercé ed io in dritto me vo cheto	283
289	Et cil dist qu il le fera	ME que dice|ch elli el farà	284|285
290	puis qu autrement ne puet estre;	poscia|ch altrimenti non può essere	286|287
291	si vient devant le chevalier	si viene davanti el cavaliere	288
292|293	et s agenoille|et li crie merci del meffet;	e gli grida mercé del misfatto in ginocchione	289
294	et cil li pardone tot	e que gli perdona tutto	290
295	Et lors remonte li chevaliers conquis	Allor monta el cavaliere conquiso	291
296	et dist a Agloval Sire fet il il est huimés tens	e disse ad Aglovalle|	292|293
		diss egli	294
297	et hore de herbergier a lkar la nuis i aproche molt durement	egli è ogimai ben tempo d albergare|ché lla notte apressima molto duramente	295|296
298	et j ai pres de ci un recet molt aaisié:	e io ò presso di qui uno recetto molto adagiato	297
299	por ce vos pri	; perciò vo priego io	298
300	que vos veigniés anuit mes herbergier o moi	che vo' vegniate con esso meco ma oggi ad albergare	299
301	et vos i seriés plus a aise	e vo' vi sarete più adagiato	300
302	que vos ne seriés en lieu ou vos puissiés huimés venir	che voi non sarete in luogo ove voi possiate oggimai venires	301
303	Et Agloval l'otroie	E Aglovalle il consente	302
304	puis demande al chevalier qu il avoit rescos	; poscia domanda Aglovalle al cavaliere	303
305	dont il est;	ch elli avea riscosso dond egli è	304
306	et il dist qu il est del chastel de Roguedon	ed e' gli dice|ch egli è del castello di Gledon	305|306
307	qui est pres d iluec a une lieue englesche	ch è presso di qui a una lega inghilesca	307
		;	308
308	Et se vos i voliés venir je vos i feroie honorer sor tos homes	e se vo' vi volete venire|i' voi vi farò honorare sopra tutti huomini	309|310
		;	311
309	et je le doi bien fere lear vos m avés de mort rescos	e io el debbo ben fare|ché voi m avete di morte riscossos	312|313
			314
		ch egli à promesso a quello altro cavaliere	315
310	— Or vos dirai	Or vo dirò io	316
311	que vos ferois fet li chevaliers conquis	che vo' farete|disse el cavaliere conquiso	317|318
312	Vos vendrois huimés herbergier avec nos deus	Voi verete oggimai ad albergare con esso no' due	319
313	Lors	PAllor	320
314	si sera entre nos la joie greignor	si sarà la gioia intra noi due maggiore	321
315	que se nos estiom departis li uns ça li autres la	che se noi fossimo partiti l uno qua	322
316	Et Agloval r'em prie		
317	tant que cil l'otroie	e l altro là	323
318	Lors sont tuit troi retorné		
319	et vont tant qu il vienent a unes praeries		
320	qui estoient en mi la forest;		
321	et el mi lieu de ces pres avoit une tor fort		
322	et faute		
323	qui estoit close de murs		
324	et de fossés;		
325	et il vienent jusqu a la tor		
326|327	si entrent ens|Et cil de laiens corent as estriés	ché noi non ci troveremo di leggeri insieme	324
328	si les font descendre		
329	puis les desarment lar grant mestier avoient de reposer		
330	Et quant il sont alegié de lor armes li sires de laiens les maine en sa mestre sale		
331	Lors li demande Agloval comment il a non		
332	et il dist qu il a non Grifon del Mal Pas		
333	Et vos bials sire fet il a Agloval	E Aglovalle liel consente	325
334|335	dont estes a vos|? s	Allor sono tutti ritornati	326
336	Et il dist qu il est de la maison le roi Artu		
337	Et qu alés vos querant		
338			
339	Et il li conte tote l aventure de la roine		
340	et de Lancelot	e vanno romitaggio	327
341|342	et comment ele vit|que I	che quelli gli avea detto	328
343	chevaliers em portoit la teste		
344	b «	E	329
345	Si avom fet il tuit juré a que se nos poons le chevalier trover ne conoistre		
346	que nos en aporterom la teste al roi e;		
347	et por ceste chose somes nos meu de la cort tresqu a dis chevaliers		
348|349	Quant Gritons ot ce|que Agloval dist	si tosto come Aglovalle	330
350	si se pense qu il porra fere lar il set bien que s Agloval le conoist til ne croira mie qu il n ait Lancelot ocis;		
351|352	si l en covendra morir s il en set novele|Lors dist	si fu partito di là entro	331
353	que ce seroit trop grans damages se Lancelos estoit mors		
354	Mes totes voies bials sire fet il i perdistes plus		
355	que Lancelot		
356	? — Oil en non Dieu fet il nos i perdimes Keu le seneschal		
357|358	et Saigremor le Desreé|et Dodinel le Salvage;	Grifon venne a Cheu il Siniscalco	332
359	mais de la perte d els tos ne nos est mie autant		
360	? comme de Lancelot		
361	— Voire bials sire		
362	et qui vos rendroit Keu le seneschal		
363	dont ne l en savriés vos molt buen gré		
364	? —		
365	Si m art Diex fet il oil		
366	et molt en avroie grant ioie		
367	Or sachiés donc fet il		
368	que se vos estes demain a l ermitage de la Haie		
369	que vos l i troverois sans faille	ch elli avea in sua pregione	333
370	— En non Dieu sire fet il molt grans mercis		
371	Cele nuit jut laiens Agloval		
372	et a l endemain se leva	e gli disse	334
373|374	si tost com il vit le ior|et prist ses armes a;	: aMonsignor Keu	335
375|376	si ehevalche droit vers l'ermitage|que cil ti avoit dit	vo' siete dilivero di mia pregione	336
377	Et quant il se fu partis de l ostel ou il avoit geu Grifons vint a Keu le seneschal qu il avoit en sa prison		
378	et li dist Sire Kex vos estes delivrés de ma prison		
379	et li conte comment b	e gli conta come|	337|338
380	et je vueil	diss elli	339
381	que vos vos en ailliés de ci a l ermitage de la Haie	che voi ve n andiate di qui al romitaggio di l Oie	340
382	et vos rendés a Agloval	e vo rendete ad Aglovalle	341
		;	342
383|384	Et s il vos demande|qui vos i envoie	e s elli vi domanda chi vi manda	343
385	si li dites	si gli dite	344
386|387	que vos ne savés|qui ;	che vo' non sapete chi	345
388	et por ce	E per ciò	346
389|390	que je ne|? vueil mie a	ch io non voglio	347
391	que nus sache de moi noveles vueil je	che nullo sappia di me novelle|voglio	348|349
392	que vos me fiançois	che voi mi giuriate	350
393	que vos ne dirois en lieu ou vos veingnois	che voi non direte di me novelle in luogo ove voi vegniate	351
394	que Et vos aiés çaiens esté ne nel dirois a home né	né direte a huomo|che voi abiate qua entro stato	352|353
395	cil li fiance	que' gliel giura	354
396	qui molt est liés de ceste delivrance;	che molto est lieto di questa diliveranza	355
397	si li fet Grifons aporter a mengier	E Grifon gli fa aportare da mangiare	356
398	et puis commande	poscia comandò	357
399	que l en li aport ses armes	che l uomo gli facesse portare sue armi	358
400	et eles li sont aportees	e elle gli sono aportate	359
401	Si se part de laiens		360
402	et vet tant qu il vient a hore de tierce al lieu	e fa|tanto che viene a ora di terza al luogo	361|362
403	que l en li avoit dit a;	che Grifon gli avea detto	363
404	si trova Agloval	Si vi trovò Aglovalle	364
405	qui molt fist grant joie de lui	che molto fece gran gioia di lui	365
406	quant il le vit	e quando elli el vide	366
