0	— Naie par foi fist Joseph ains sui crestiens	Padre	0
2206	et del serpent duroit ensi sera en cel point la iumiere de vostre proesce estainte	e de leopardo durava in quel punto|insi sarà el lume del vostro valore inanzi	2322|2323
2207	Aprés	che lla battaglia del re|e del cavaliere sia	2324|2325
			2326
2208	quant li rois sera revenus en son païs ausi com li serpens revint en la chambre li corront sus	quando el re sarà ritornato in suo paese|altresi come il serpente rivenne in sua camera	2327|2328
		si gli coreranno suso suoi huomini medesimi	2329
2209	si home ausi com li serpentel faisoient au serpent	altresi come i serpentelli corsono sopra el gran serpente|;	2330|2331
2210	et duerra la bataille longuement tant qu il ocirra els	e durerà la battaglia molto lungamente|e tanto	2332|2333
2211	et els lui	ch e gli ucidrà ed eglino lui altresi|e ciò averrà al re Artù vostro zio	2334|2335
2212	Or avés or	voaOra avete udito	2336
2213	que li serpens senefie :	che l gran serpente significa	2337
2214	si ai fet vostre volenté ausi weil je	e si ò fatto vostra volontà del dire|; altresi voglio	2338|2339
2215	que vos raçiés la moie de ce	che voi facciate la mia di ciò	2340
2216	que je vos requerrai	ch i' vo richiederò	2341
2217	Et mesire Gauvain li creante	E monsignor Galvano gliel giura	2342
2218	que si fera il	che si farà elli	2343
		uOr vo conviene	2344
		dunque	2345
2219	Or vos covient done a jurer sor sains	disse el romito|giurare sopra i santi	2346|2347
2220	que jamés jor de vostre vie ne parlerois de ce	che giamai giorno di vostra vita none parlerete di ciò	2348
2221	que je vos ai dit ne	ch io vo ho detto	2349
2222	que vos ne le ferois savoir ne a home ne a feme	né nol farete sapere a huomo né a feminas	2350
2223	Et il li jure sor a sains	ed e' gliel giura sopra i santi|	2351|2352
2224	mais molt est esmaiés des paroles qu il li dites	ch e' gli à dette|e molto	2353|2354
		si maraviglia chi I cavaliere può essere	2355
		che tanta fia d alta rinomia	2356
2225	Si laisse atant ester	; esi l domandasse volentieri al romito|ma e' non ne l osa richiedere per ciò	2357|2358
		che difeso gliel'avea	2359
2226	et fet molt plus bele chiere	si fa molto più bella cera	2360
2227	que li cuers ne li aporte;	che l cuore no gli porta	2361
2228	si remist laiens cele nuit	Si rimase là entro quella notte	2362
2229	et fu aaisiés de quanque li preudom pot avoir	si fu molto bene adagiato di quanto|che l produomo poté avere	2363|2364
2230	Et al matin	Al mattino	2365
2231	si tost com il ot or messe de la boche de l ermite meismes prist ses armes	si tosto com egli ebbe udito messa|prese sue armi	2366|2367
		e monta in su cavallo	2368
		e comanda molto el romito a doio	2369
2232	et monta en son cheval ausi com il avoit fet le jor devant	e si rimise in suo camino|insi com elli avea fatto il giorno davanti	2370|2371
		Si cavalca	2372
2233	Mais or laisse atant li contes a parler de lui	la testa inchinata verso la terra|si è più dolente	2373|2374
		e più pensoso	2375
		ch elli avesse unque mai stato	2376
		eMa atanto lascia ora il conto a parlare di lui	2377
2234	et retorne a Hestor	e ritorna ad Astore di Mare	2378
2235	qui est entrés en sa queste	che s è messo in sua via	2379
2236	Or dit li contes que	Pelrl questa partita dice el conto che	2380
2237	quant Hestor se tu partis de mon seignor Gauvain qu il erra par mi la forest vers tierce		
2238	et lors encontra	quando Astore	2381
2239	I	si fu partito da monsignor Galvano|ch elli andò per me la foresta infino qua a vespero	2382|2383
2240|2241	naim sor I|chaceor	'Allora incontrò per me' suo camino uno nano sopr un cacciatore	2384
2242	qui venoit le trot	che veniva tutto l trotto	2385
2243	Et quant li nains vint pres de lui	; 'e quando l nano venne presso d Astor|si gli disse	2386|2387
2244	si li dist Sire chevaliers vos alés trop avant ! Coment bials amis	Sire cavaliere|vo' andate troppo	2388|2389
			2390
		bello amico	2391
2245	? fet Hestor	?|disse Astore	2392|2393
2246	— Ja plus fet il n'en savrois par moi	— Già più|disse l nano	2394|2395
2247	Si s en torne sans plus dire	non ne saprete per me	2396
2248	Et Hestor chevalche totes voies lar molt li est a poi de ce	Atanto se ne torna su' camino sanza più dire|e Astor cavalca tuttavia	2397|2398
2249	que li nains li a dita tant qu il vint a II	ché molto gli è a poco di ciò|che l nan gli disse	2399|2400
2250	perrons	Si va|tanto che venne a due petroni	2401|2402
2251	qui estoient en mi le chemin	ch erano nel miluogo del camino	2403
2252	si avoit letres	si v avea lettere scritte	2404
2253	qui disoient Ja nus n ira avant de ci s il ne quiert sa honte	che dicieno|: Già nullo non andrà avanti di qui se non chiede sua onta	2405|2406
2254	Il conut les letres	Ed e' legge le lettere	2407
2255	et bien set qu eles vuelent dire b	e ben sa|ch elle vogliono dire	2408|2409
2256	mais por ce ne retornera il pas	; 'ma per ciò non ritornerà elli passo	2410
2257	si com il dit	si come dico	2411
		che nullo non dee aver dottanza davanti	2412
		che l uomo vega il perché	2413
2258	kar nus ne doit avoir dotance devant qu il voie le porquoi: se se met tot le droit chemin de la forest tant qu il vint a a l issue	Si se ne va il diritto camino della foresta|tanto che lla trapassò	2414|2415
		si venne all uscita	2416
2259|2260	et il ot osté de sa teste son hialme|por le chaut	; eed egli ebbe tratto suo elmo di sua testa per lo caldo	2417
2261	qui trop grans estoit	che troppo grande era	2418
		si ebbe suo viso scoperto	2419
		che molto fu colorito	2420
		e bello	2421
2262	eles li dient Ha sire chevaliers tant est grans	come colui|che troppo era bello cavaliere di sua giovaneza	2422|2423
2263	Et lors encontre Il	Allora incontrò elli	2424
		tutto el gran camino	2425
2264	damoiseles	due damigelle	2426
2265	si les salue	si lle saluta	2427
2266	et damages	ed elle lo sguardano|si gli dicono	2428|2429
		: eHal	2430
		sire cavaliere	2431
2267	quant vos ceste part venistes ! —	tant è gran damaggio|che voi in queste parti veniste	2432|2433
2268	Por quoi	— E perché|?	2434|2435
2269	? fet il	disse Astore	2436
2270	—	— Per ciò	2437
2271	Por ce font eles	dicono elle	2438
2272	que vos ne poés eschaper	che vo' non pote scampare	2439
2273	que vos ne muiriés	che vo' no ne moiate	2440
2274	et ce sera molt grans damagesa	e ciò sarà troppo gran damaggio	2441
2275	kar vos estes trop bials	ché vo' siete troppo bel cavaliere|e gente	2442|2443
2276	Hestor ne s esmaie	Ma Astor non	2444
2277	por chose	si smaga miga di cosa	2445
2278	que celes li dient ains les commande a Dieu	ch elle dicano|anzi le comanda a' dDio	2446|2447
2279	et s en vet tot droit vers un chastel qu il vit devant lui	e se ne va dritto inverso d uno castello|ch elli vide davanti lui	2448|2449
2280	Et quant il vint pres	;|e quand elli vi venne presso	2450|2451
2281	si vit une eve	si vi vide un acqua	2452
2282	qui molt estoit roide	che molto era rodda	2453
2283	et profonde	e perfonda	2454
2284	et par desus avoit un pont de lé	e per di suso avea uno ponte	2455
2285	? de IlIl	che bene era di largo iiii	2456
2286	toises	passini	2457
2287		“Ed e' viene infin qua un olmo	2458
2288	et trueve une damoisele	e truova una damigella	2459
2289	qui seoit desos	che ssi sedea di sotto|ed	2460|2461
2290	Il le salue	e la saluta ed ele disse|: eHal	2462|2463
2291	et ele li dit Ha sire chevaliers mar i alez a cel chastel	cavaliere|male andate a quel castello	2464|2465
2292	que vos seriés ja noiés	ché vo' vi sarete già anegato	2466
2293	— Comment damoisele	— Come|damigella	2467|2468
2294	? fet il	?|disse Astore	2469|2470
2295	— Je le vos dirai ret ele	— l''l vo dirò	2471
		disse la damigella	2472
		ché piatà mi prende di voi	2473
		che troppo sembiate tenero cavaliere	2474
		Si gli disse	2475
2296	Veez vos cel chevalier par dela cel pont devers cel chastel	:«Vedete voi quel cavaliere|per di là quel ponte	2476|2477
		per diverso quel castello	2478
2297	? — Oil fet il je le voi bien	? — Oil|damigella	2479|2480
		disse elli	2481
		il vego bene	2482
		— Sappiate	2483
2298	— Sachiés fet ele qu il est	disse la damigella|ch egli è	2484|2485
2299	si buens josterres	si buono giostratore	2486
2300	que je ne sai nui meillor el monde	ch io non ne so uno migliore nel mondo	2487
		ed e' voi converrà a llui giostrare	2488
		:	2489
		si so bene	2490
2301	et il vos covendra a lui joster; lsi sai bien qu il vos metra la ou il met les autres	ch elli vo metterà là ov elli mette gli altri|— E ove gli mette elli donque	2491|2492
		damigella	2493
2302	—	?	2494
2303	Et ou les met il	disse Astore	2495
		— Per fé	2496
2304	? — Par foi fet ele il ne trueve nul	diss ella|e' non ne truova nullo	2497|2498
2305	que il ne port en l eve	che non porti nell acqua	2499
2306	et lui	e lui	2500
2307	et le cheval	e l cavallo	2501
2308	et por ce vos loeroie je	;e perciò vo loderei io	2502
2309	que vos n alissiés mie cele part lkar en joster a lui ne poés vos riens gaaignier	che vo' non v andaste mica in quelle parti|ché giostrare a llui non potreste vo nulla guadagnare	2503|2504
		— Damigella	2505
2310	— Damoisele fet il ce verrai je par tens	disse Astore|ciò vedrete voi per tempos	2506|2507
2311	Si le commande a Dieu	Poscia la comanda a dDio	2508
2312	et vient jusqu al pont	e viene infino al ponte	2509
		;	2510
2313	et quant il est venus a l entree	e quand|e fu all entrata	2511|2512
2314|2315	si trueve un glaive apuié a un arbre|et il le prent	si vi trovò una lancia apoggiata a uno albero ed e' la prende	2513
2316	kar ausi n en avoit il point;	ch altresi non avea elli punto	2514
2317	si se met sus le pont	Si si mette sopra el ponte tutto a cavallo	2515
		e lo scudo davanti el petto	2516
		la lancia in pugno	2517
		e l elmo lacciato in capo	2518
2318	Et ti chevaliers	E T cavalier	2519
2319	qui d autre part estoit li crie qu il se gart de lui	che dall altra parte era lo sgrida|che ssi guardi da llui	2520|2521
2320	et il dist	ed e' dice	2522
2321	que si fera il a son pooir	che si farà elli a suo podere|se puote	2523|2524
2322	Lors laisse corre li uns a l autre les glaives aloingniés	Allor lascia corere l uno a l altro|le lanci islungate	2525|2526
2323	si s entrefierent sor les escus les greignor cops qu il pueent	e si trafegono sopra gli seudi i maggiori colpi|ch elli possono	2527|2528
2324	Li chevaliers fet son glaive voler en pieces		2529
2325	et Estors le fiert	e Astor fiede lui	2530
2326	si durement qu il abat lui	si roddamente|ch elli el trabocca	2531|2532
		e lui	2533
2327	et le cheval en l eve;	e l cavallo nell acqua	2534
2328	et se li chevaliers n eust trové uun pel a coi il se tint noiés fust sans faille	: el se l cavaliere non avesse trovato uno palo a|che elli	2535|2536
		si tenne	2537
		anegato fosse sanza fallo	2538
2329	Et Hestor nel regarde plus aïns s en vet tot droit a la porte del chastel	E Astor nol riguarda più|anzi se ne va tutto diritto alla porta del castello	2539|2540
2330	et quant il cuide entrer dedens	:Pe quando elli crede entrare di dentro	2541
2331	si li clost l en la porte a l encontre	si gliele chiuse l uomo incontro	2542
2332	et il demande a un home	ed e' domanda a un uomo	2543
2333|2334	qui desus les murs estoit|por quoi il l ont fermee	che n sulla porta era perché gliel'avieno chiusa	2544
2335	Por ce fet il	|disse la guardia	2545|2546
2336	que nus chevaliers estranges n i entre s il ne jure ançois qu il deliverra cest chastel des malvaisses costumes	che nullo cavaliere strano non c entra se non ci giura in prima|che diliverrà questo castello de malvagi costumi checei sono	2547|2548
2337	qui i sont a son pooir	e farà tutto suo podere di trarneli|— Per fé	2549|2550
		disse Astor	2551
2338	— Par foi fet Hestor se malvaisses costumes i a je sui pres d'oster les a mon pooir	se malvagi costumi ci à|io sono presto di trarneli a mio podere	2552|2553
2339	— Me creantés vos loialment fet cil	—El giurate voi lealmente|disse colui	2554|2555
2340	que vos en ferois vostre puissance	che vo' ne farete vostra possanza	2556
2341	? — Ol fet il je le vos creant comme loials chevaliers	? — Oil	2557
2342|2343	a a a mon pooir|Tot ce ferai ie volentiers ret Hiestor	disse Astore	2558
2344	et jou le creant loias	i' l vo giuro lealmente	2559
2345	Et l en li oevre maintenant la porte;	E l uomo gli apre immantanente la porta	2560
2346	si entre Hestor laiens	si entra dentro Astor	2561
2347	et lors demande des costomes del chastel quels eles sont	e allor domanda de costumi di là entro quale sono|	2562|2563
2348	Nos les vos dirons font il	disse quelli|: egli è vero	2564|2565
2349|2350	Il est voirs qu il a caiens|I	ch egli à qua entro uno cavaliere	2566
2351	chevalier le plus felon	el più crudele	2567
2352	et le plus cruel del monde	e l più fellon del mondo	2568
2353	et est sire de cest chastel	ed è signore di questo castello	2569
2354	mais il est	ma egli è	2570
2355	si preus as armes	si pro' all armi	2571
2356	que nos ne savons nul meillor de lui	che noi no ne sapiàno niuno più pro' di lui	2572
2357	Et por ce qu il sent en lui	E per ciò|che sente in lui	2573|2574
		si gran prodeza	2575
2358	si grant proesce se combat a tos les chevaliers	si combatte elli a tutti|e cavalieri	2576|2577
2359	que aventure amaine ceste part	che aventura mena in queste parti	2578
2360	Et quant il en a alcun vaincu	e quand|e n à alcuno conquiso	2579|2580
2361	si le fet despoillier tot nu	si 'l fa dispogliare tutto ignudo	2581
2362	et puis le fet trainer par totes les rues de ceste vile	: apresso el fa tranare per tutte le rughe di questa villa	2582
2363	Tiels est une des costumes de çaiens	Tale est una delle costumi di qua entro	2583
2364	et c est as chevaliers estranges	e ciò è a' cavalieri strani	2584
2365	Mais encore en i a une plus vilaine	Ma ancor ce n à elli un altra	2585
2366	et si est a nostre oes;	che più est villana a nostro huopo|:	2586|2587
2367	kar il n est nus des mois de r'an qu il ne preingne une de nos files	che non è nullo de' mesi dell anno|che non prenda una delle nostre figliuole	2588|2589
2368	por qu ele soit pucele	purch ella sia pulcella	2590
		;	2591
2369	et gist a force a li	si giace a forza a llei	2592
2370	et puis la livre as garçons a tenir en soignantage	e poscia la dona a suoi garzoni a tenere in sua balia	2593
2371	Et ensi en a honies plus de XL		2594
2372|2373	dont nos tuit somes hontels|et dolens	donde noi siamo ontosi	2595
		e dolenti	2596
2374	si que nos voldrions miels morir	sicché noi voremo meglio morire	2597
2375	que vivre	che vivere	2598
2376	Ce sont les malvaises costumes del chastel:	eCiò sono i costumi di questo castello	2599
2377	si covient	si conviene	2600
2378	que vos metois paine a oster les ou vos serrois pariures	che vo' ci metiate pena a trarneli o vo sareste ispergiuro	2601
2379	Et il dist qu il en fera molt volentiers son pooir	Ed e' dice|che nne farà volentieri tutto suo podere	2602|2603
		ma come	2604
2380	Mais comment porrai ie trover le chevalier	diss elli|potrò io trovare el cavaliere	2605|2606
2381	? — Molt aaisiement font il	|dicono elli	2607|2608
2382|2383	kar nos vos menrons la ou il est|s	ché no' vo manderemo ov'egli ès	2609
2384	Lors le mainent en un molt bel jardin tot plain d arbroisials fors tant qu il avoit en mi lieu une place	Allor lo menano in uno giardino pieno d arbuscelli|forse tanto	2610|2611
		ch elli avea nel miluogo una piaza	2612
2385	qui bien duroit un arpent de lonc	che bene durava una balestrata di lungo	2613
2386	et de lé	e di lato	2614
2387	et estoit close tot entor de lons piex agus	ed era chiuso intorno di buon pali aguti	2615
2388	et fors;	e forti	2616
2389	si li mostrent un cor d ivoire	Allor gli mostrano uno corno di vivorio	2617
2390	qui pendoit a un pin	che pendeva a uno pino	2618
2391	et li dient qu il li covient soner cel cor s il velt	ed e' gli dicono|che l corno gli conviene sonare	2619|2620
2392	que li chevaliers viegne avant	se vuole cavaliere vegna avanti	2621
		Quando Astore ode ciò	2622
		si prende immantanente el corno	2623
2393	Et il le prent tantost	e l mette a sua bocca	2624
2394	si le sone	si lsuona	2625
2395	si haut	si altamente	2626
2396	que bien grant chevalier tot desarmé	che bene l udisse l uomo di meza lega di lungi|mmantanente vide uscire d una torre uno cavaliere tutto disarmato	2627|2628
2397|2398	et fu montés sor I|grant destrier blanc;	e fu montato sopr un gran destrieri bianco	2629
2399	et li chevaliers fu ros	e l cavaliere fu rosso	2630
2400|2401	et lentilloz|et ot le nes bas	e litiginoso ed ebbe el viso corto	2631
2402	et rechignié :	e ricagnato	2632
2403	si sambla trop bien cruel home	si risembiava bene crudele huomo	2633
2404	et felon	e fellone	2634
		e sanza mercé	2635
2405	Et la ou il vit Hestor	E là ove vide Astore	2636
2406	si le salua maintenant	si l saluta tutto immantanente	2637
		e gli disse	2638
2407	et li dist Diex vos saut sire chevaliers	Dio vi salvi|sire cavaliere	2639|2640
2408	Et Hestor li rent son salu a grant paine	WEd Astore gli rende suo saluto a gran pelna	2641
2409	Bials sire fet cil	Bel sire	2642
2410	dont estes vos	disse quelli	2643
		donde venite voi	2644
		e di qual paese siete	2645
2411	? —	? — E	2646
2412	Que vos en chaut fet Hestors	che vo ne cale|disse Astore	2647|2648
2413	dont je soie	dond io sono	2649
2414	? Ja par moi nel savrois ore se vos ne me creantés a fere tot mon plaisir	? Già per me no llo saprete ora|se vo' non mi giurate a fare tutto un piacere	2650|2651
		—Vostro piacere	2652
		disse quelli	2653
2415	— Vostre plaisir fet cil ne feroie je pas se je ne veoie mon preu	non farò io passo|s i' non ne veggio mio pro	2654|2655
2416	et m onor	e mio honore	2656
2417	Et dites moi quels vostre plaisirs seroit	; ma ditemi qual vostro piacere sarebbe	2657
		— Certo	2658
2418	— Certes fet Hestor se vos me juriés sor sains	disse Astor|se vo' mi giurate sopra i santi	2659|2660
2419	que jamés ne feriés honte a chevalier ne deshonor	che giamai non farete onta né disinore a cavaliere poscia	2661
2420	puis que conquis l avriés vos feriés mon plaisir;	che vo l arete conquiso|vo' farete mio piacere	2662|2663
2421	et d autre part se vos me creantiés	|se vo mi giurate	2664|2665
2422	que jamés ne feriés honte a vos homes de lor filles encor le feriès vos miels	che giamai non farete onta a vostri huomini di loro figliuole|ancor la fareste vo' meglio	2666|2667
2423	Et lors m acorderoie je a vos a		2668
2424	et vos diroie	e voi direi	2669
2425	qui je sui	ch io sono	2670
2426	et dont		
2427	—	|?	2671|2672
2428|2429	Et vos nel diriés pas altrement|? fet cil	disse quelli	2673
2430	— Non voir fet Hestor	— Non vere|disse Astore	2674|2675
2431	Or sachiés donc fet cil	— Or sappiate|disse quelli	2676|2677
2432	que jamés a chevalier ne ferai honte devant	che giamai a cavalieri non farò onta davanti	2678
2433	que je la vos aie fete	ch i' la voi abbia fatta	2679
2434		Immantanente	2680
2435	et s en vet armer;	si parti del luogo|e se ne va ad armare	2681|2682
2436	et cil	e quelli	2683
2437	qui en la place estoient dient a Hestor Sire savés vos	che nella piaza erano dicono ad Astore|Hal	2684|2685
2438	por quoi il vint tos desarmés	sire|or vo guardate di lui	2686|2687
		ché sapiate	2688
		che ciò è el più disleale del mondo	2689
		;	2690
		e sapete voi perché elli venne tutto disarmato	2691
2439	? Il vos cuidoit tant faveler de paroles	? E' vo credette tanto favellare di parole	2692
2440	que vos feissiés pes a lui	che vo' faceste pace a llui	2693
2441	et que vos ostissiés vos armes;	e che vo traeste vostre armi	2694
		“E	2695
2442	et si tost com vos fuissiés desarmés il vos feist prendre	si tosto come vo' foste disarmato|e vo facesse prendere	2696|2697
2443	et fere tote la honte	e fare tutta l onta	2698
2444	que l en porroit dire de boche:	che l uomo può dire di bocça|:	2699|2700
2445	si a en tel maniere honi maint preudome	si à elli in tale maniera oniti molti produomini	2701
2446	et maint buen chevalier	e molti buoni cavalieri	2702
2447	qui encore en seront vengié en alcun tens se Dieu plest	che ancora e' ne saranno vendicati in alcuno tempo|se Dio piace	2703|2704
		sIn tale maniera dicieno quelli di là entro ad Astor la crudeltà del cavaliere	2705
			2706
2448	En ce qu il parloient issi li chevaliers de la tor	ch elli parlavano insi|si usci el cavaliere della torre	2707|2708
2449	et fu molt richement armés d unes armes vermeiltes	e fu molto riccamente armato d une armi vermiglie	2709
2450	et ot a son col I escu vermeil	ed ebbe in su' collo uno scudo vermiglio	2710
2451	et une tance en son poing;	e una lancia in suo pugno	2711
2452	et la ou il vit Hestor	; ce là ove e' vide Astore|si gli disse	2712|2713
2453	si li dist Sire chevaliers huimés vos devés vos garder de moi	Sire|oggimai vo vo guardate di me	2714|2715
2454	que je ne vos asseur pas	ch i' non voi asicuro mica	2716
2455	— Ne ie vos fet Hestor kKar onques ne vi chevalier	— rNé i voi|disse Astore	2717|2718
2456	que je peuisse tant haïr com je faz vos	ch unque non vidi cavaliere cui io potesse tanto odiare com io faccio vois	2719
2457	Lors entrent en l arpent	“Allora entrarono nel rimonito	2720
2458	qui estoit clos	ch era chiuso	2721
2459	si com je vos ai dit	si come io v ô detto	2722
2460	et laisse corre li uns vers l autre les glaives aloigniés	Allora lascia corere l uno a l altro|le lance islungate	2723|2724
2461	et s entrefierent sor les escus	e si trafegono sopra gli scudi	2725
2462|2463	si grans cops|que li glaive sont pechoié ;	si gran colpiche lle lance sono rotte	2726
		; “ed e'	2727
2464	si s entrehurtent des cors	si trapercuotono di corpi	2728
2465	et des visages	e di visaggi	2729
2466	si durement qu il se portent des chevals a terre	si duramente|che si portano de cavalli in terra	2730|2731
2467	si estordi qu il n i a celui	si istordito|che no v à colui	2732|2733
2468	qui tos ne soit estonés	che tutto non sia stornato	2734
2469	Mais Hestor se redreça tos premiers	Astor|si diriza primieri	2735|2736
2470	et met la main a l'espee	e mette la mano a la spada	2737
2471	et cil refet autretel	e que rifa altretal	2738
2472	qui de grant force estoit;	che di gran forza era|;	2739|2740
2473	si s entrecorent sus les espees drecies contremont a	si si tracorrono suso alle spade dirizate incontro a monte	2741
2474	et s entredonent par mi les hialmes grans cops	e si tradonano per me' gli elmi|si gran colpi	2742|2743
2475	si qu il en font le feu saillir	che nne fanno el fuoco salire	2744
2476	Et li oeil lor estincelent es testes au fes des cops qu il s entredonent;	;|e gli occhi loro stancelliscono nella testa al fascio de colpi	2745|2746
		che si tradonano	2747
2477	si se depiecent les escus	si si dispezano gli scudi	2748
2478	et les haubers	e gli asberghi	2749
2479	et se mainent une hore avant	e si menano un ora avanti	2750
2480	et autre ariere	e un altra adietro	2751
2481	si se font le sanc saillir des espaules	; i|si fanno el sangue salire delle spalle	2752|2753
2482	et des bras	e delle braccia	2754
2483	et des testes	e delle teste	2755
		e dispezano gli elmi apresso	2756
		e colpi delle spade trincanti	2757
		e chiare	2758
2484	et sont al premier assaut	;|e sono nel primaio asalto	2759|2760
2485	si par igal	si per iguali	2761
2486	que l en ne peust pas legierement le meillor eslire lkar li mains vailtans estoit plains de grant proesce	che l uomo non potesse miga legermente el migliore eslegere|ché l meno valente era pieno di gran prodeze	2762|2763
2487		Tanto|si sono insi combatuti	2764|2765
2488	qui assés ne soit las	che non v à colui|che assai non sia lasso	2766|2767
2489	et traveilliés	e travagliato	2768
2490	Mes cil del chastel a	PMa il cavalier del castello à	2769
		si gran caldo	2770
2491	si tres grant chaut qu a poi qu il ne muert d anguoisse:	ch a poco|che non muore d angoscia	2771|2772
2492	si est molt enpiriés d alaine	si è molto impegiorato d alena	2773
2493	et de force a	e di forza	2774
2494	Et Hestors le haste	EAstor lo studia	2775
2495	si durement qu il li covient guenchier as cops de l espee Hestor	si duramente|ch elli il conviene schencire per la spada d Astore	2776|2777
2496	qui mainte fois l a tasté jusqu al sanc;	che molte fiate l à già tastata infin qua la carne ignuda|PSi	2778|2779
2497	si bSe cuevre de son escu tant com il puet	si cuopre di suo scudo tanto come puote	2780
2498	et Hestors gete totes voies com cil	e Astor getta tuttavia come colui	2781
2499	qui molt avoit longue alaine;	che molta avea forza|e alena	2782|2783
		;	2784
2500	si le fiert sor le bras	si gli piaga un colpo da monte|e 'l fiede sopra I braccio	2785|2786
2501	dont cil tenoit l espee	donde e' teneva la spada	2787
2502	si qu il li fet voler le poing a tot l espee a terre	sicché gli fa volare el pugno con tutta la spada in terra	2788
2503|2504	et cil giete I|cri molt doleroz	e que' getta uno grido troppo maraviglioso	2789
2505	Et Hestor remet s espee el fuerre	;|e Astor rimette la spada nel fodero	2790|2791
2506	si prent celui par le hialme	e prende colui nell elmo	2792
2507	et li esrache de la teste	e gliele arappa della testa	2793
2508	et dist qu il li trenchera le chief s il ne se tient	e gli dice|che gli trincherà el capo	2794|2795
2509	por outré	se non	2796
2510	et cil dist	si tiene per oltrato|E que dice	2797|2798
2511	que ce ne sera ja se Diex li art	che non farà|se Dio l aiuti	2799|2800
2512	Et Hestor met la main a l espee	;|e Astor mette la mano alla spada	2801|2802
2513	si le fiert par mi le col	e gli dona tal colpo	2803
2514	si qu il li fet la teste voler loing plus d une lance	che gli fa la testa volare più d una lancia lungi	2804
2515		Allor domanda coloro	2805
2516|2517	qui entor lui sont|si li covient plus a fere	che intorno lui sono se ne gli conviene più fare	2806
		ed e' dicono	2807
		che si	2808
		: eElli vo conviene	2809
